title,openreview_link,authors
OpenGSL: A Comprehensive Benchmark for Graph Structure Learning,https://openreview.net/forum?id=yXLyhKvK4D,"Zhou Zhiyao, Sheng Zhou, Bochao Mao, Xuanyi Zhou, Jiawei Chen, Qiaoyu Tan, Daochen Zha, Yan Feng, Chun Chen, Can Wang"
Simplicity Bias in 1-Hidden Layer Neural Networks,https://openreview.net/forum?id=PTvxck0QDE,"Depen Morwani, Jatin Batra, Prateek Jain, Praneeth Netrapalli"
Neural Polarizer: A Lightweight and Effective Backdoor Defense via Purifying Poisoned Features,https://openreview.net/forum?id=VFhN15Vlkj,"Mingli Zhu, Shaokui Wei, Hongyuan Zha, Baoyuan Wu"
Diffused Redundancy in Pre-trained Representations,https://openreview.net/forum?id=LyAuNoZkGP,"Vedant Nanda, Till Speicher, John Dickerson, Krishna Gummadi, Soheil Feizi, Adrian Weller"
Shared Adversarial Unlearning: Backdoor Mitigation by Unlearning Shared Adversarial Examples,https://openreview.net/forum?id=zqOcW3R9rd,"Shaokui Wei, Mingda Zhang, Hongyuan Zha, Baoyuan Wu"
Auslan-Daily: Australian Sign Language Translation for Daily Communication and News,https://openreview.net/forum?id=g5v3Ig6WVq,"Xin Shen, Shaozu Yuan, Hongwei Sheng, Heming Du, Xin Yu"
Fairness Aware Counterfactuals for Subgroups,https://openreview.net/forum?id=38dQv3OwN3,"Loukas Kavouras, Konstantinos Tsopelas, Giorgos Giannopoulos, Dimitris Sacharidis, Eleni Psaroudaki, Nikolaos Theologitis, Dimitrios Rontogiannis, Dimitris Fotakis, Ioannis Emiris"
Accelerating Molecular Graph Neural Networks via Knowledge Distillation,https://openreview.net/forum?id=A18PgVSUgf,"Filip Ekström Kelvinius, Dimitar Georgiev, Artur Toshev, Johannes Gasteiger"
LagrangeBench: A Lagrangian Fluid Mechanics Benchmarking Suite,https://openreview.net/forum?id=8ZRAHNT7E9,"Artur Toshev, Gianluca Galletti, Fabian Fritz, Stefan Adami, Nikolaus Adams"
GlyphControl: Glyph Conditional Controllable Visual Text Generation,https://openreview.net/forum?id=thPI8hrA4V,"Yukang Yang, Dongnan Gui, YUHUI YUAN, Weicong Liang, Haisong Ding, Han Hu, Kai Chen"
Implicit Manifold Gaussian Process Regression,https://openreview.net/forum?id=co4p15OMoc,"Bernardo Fichera, Slava Borovitskiy, Andreas Krause, Aude G Billard"
Likelihood Ratio Confidence Sets for Sequential Decision Making,https://openreview.net/forum?id=4anryczeED,"Nicolas Emmenegger, Mojmir Mutny, Andreas Krause"
BQ-NCO: Bisimulation Quotienting for Efficient Neural Combinatorial Optimization,https://openreview.net/forum?id=BRqlkTDvvm,"Darko Drakulic, Sofia Michel, Florian Mai, Arnaud Sors, Jean-Marc Andreoli"
Learning Dynamic Attribute-factored World Models for Efficient Multi-object Reinforcement Learning,https://openreview.net/forum?id=bsNslV3Ahe,"Fan Feng, Sara Magliacane"
Global-correlated 3D-decoupling Transformer for Clothed Avatar Reconstruction,https://openreview.net/forum?id=hlkhPdhuAO,"Zechuan Zhang, Li Sun, Zongxin Yang, Ling Chen, Yi Yang"
Neural-Logic Human-Object Interaction Detection,https://openreview.net/forum?id=QjI36zxjbW,"Liulei Li, Jianan Wei, Wenguan Wang, Yi Yang"
DAC-DETR: Divide the Attention Layers and Conquer,https://openreview.net/forum?id=8JMexYVcXB,"Zhengdong Hu, Yifan Sun, Jingdong Wang, Yi Yang"
Global Structure-Aware Diffusion Process for Low-light Image Enhancement,https://openreview.net/forum?id=bv9mmH0LGF,"Jinhui HOU, Zhiyu Zhu, Junhui Hou, Hui LIU, Huanqiang Zeng, Hui Yuan"
Post Hoc Explanations of Language Models Can Improve Language Models,https://openreview.net/forum?id=3H37XciUEv,"Satyapriya Krishna, Jiaqi Ma, Dylan Slack, Asma Ghandeharioun, Sameer Singh, Himabindu Lakkaraju"
A Multi-modal Global Instance Tracking Benchmark (MGIT): Better Locating Target in Complex Spatio-temporal and Causal Relationship,https://openreview.net/forum?id=xo6zDI8gvB,"Shiyu Hu, Dailing Zhang, wu meiqi, Xiaokun Feng, Xuchen Li, Xin Zhao, Kaiqi Huang"
PrimDiffusion: Volumetric Primitives Diffusion for 3D Human Generation,https://openreview.net/forum?id=ESCafo3oD5,"Zhaoxi Chen, Fangzhou Hong, Haiyi Mei, Guangcong Wang, Lei Yang, Ziwei Liu"
"Mean-field Langevin dynamics: Time-space discretization, stochastic gradient, and variance reduction",https://openreview.net/forum?id=9STYRIVx6u,"Taiji Suzuki, Denny Wu, Atsushi Nitanda"
Cross-Scale MAE: A Tale of Multiscale Exploitation in Remote Sensing,https://openreview.net/forum?id=5oEVdOd6TV,"Maofeng Tang, Andrei Cozma, Konstantinos Georgiou, Hairong Qi"
Learning Provably Robust Estimators for Inverse Problems via Jittering,https://openreview.net/forum?id=gUlcyeHzw1,"Anselm Krainovic, Mahdi Soltanolkotabi, Reinhard Heckel"
Last-Iterate Convergent Policy Gradient Primal-Dual Methods for Constrained MDPs,https://openreview.net/forum?id=U6bhCLSPun,"Dongsheng Ding, Chen-Yu Wei, Kaiqing Zhang, Alejandro Ribeiro"
Closing the gap between the upper bound and lower bound of Adam's iteration complexity,https://openreview.net/forum?id=yDvb3mlogA,"Bohan Wang, Jingwen Fu, Huishuai Zhang, Nanning Zheng, Wei Chen"
DiffKendall: A Novel Approach for Few-Shot Learning with Differentiable Kendall's Rank Correlation,https://openreview.net/forum?id=SVUQX1W7RL,"Kaipeng Zheng, Huishuai Zhang, Weiran Huang"
Rank-1 Matrix Completion with Gradient Descent and Small Random Initialization,https://openreview.net/forum?id=qjqJL2lfkH,"Daesung Kim, Hye Won Chung"
Compositional Generalization from First Principles,https://openreview.net/forum?id=LqOQ1uJmSx,"Thaddäus Wiedemer, Prasanna Mayilvahanan, Matthias Bethge, Wieland Brendel"
Fine-Tuning Language Models with Just Forward Passes,https://openreview.net/forum?id=Vota6rFhBQ,"Sadhika Malladi, Tianyu Gao, Eshaan Nichani, Alex Damian, Jason Lee, Danqi Chen, Sanjeev Arora"
Efficient Robust Bayesian Optimization for Arbitrary Uncertain inputs,https://openreview.net/forum?id=uDV4lA0gZ6,"Lin Yang, Junlong Lyu, Wenlong Lyu, Zhitang Chen"
FACE: Evaluating Natural Language Generation with Fourier Analysis of Cross-Entropy,https://openreview.net/forum?id=tdyLryDebq,"Zuhao Yang, Yingfang Yuan, Yang Xu, SHUO ZHAN, Huajun Bai, Kefan Chen"
Optimal Learners for Realizable Regression: PAC Learning and Online Learning,https://openreview.net/forum?id=w116w62fxH,"Idan Attias, Steve Hanneke, Alkis Kalavasis, Amin Karbasi, Grigoris Velegkas"
Recommender Systems with Generative Retrieval,https://openreview.net/forum?id=BJ0fQUU32w,"Shashank Rajput, Nikhil Mehta, Anima Singh, Raghunandan Hulikal Keshavan, Trung Vu, Lukasz Heldt, Lichan Hong, Yi Tay, Vinh Tran, Jonah Samost, Maciej Kula, Ed Chi, Mahesh Sathiamoorthy"
"Do Not Marginalize Mechanisms, Rather Consolidate!",https://openreview.net/forum?id=xBhvMu4J03,"Moritz Willig, Matej Zečević, Devendra Dhami, Kristian Kersting"
Contrastive Lift: 3D Object Instance Segmentation by Slow-Fast Contrastive Fusion,https://openreview.net/forum?id=bbbbbov4Xu,"Yash Bhalgat, Iro Laina, João Henriques, Andrea Vedaldi, Andrew Zisserman"
Minimum-Risk Recalibration of Classifiers,https://openreview.net/forum?id=kvXcHfBghm,"Zeyu Sun, Dogyoon Song, Alfred Hero"
InfoPrompt: Information-Theoretic Soft Prompt Tuning for Natural Language Understanding,https://openreview.net/forum?id=mSNfjOcDUv,"Junda Wu, Tong Yu, Rui Wang, Zhao Song, Ruiyi Zhang, Handong Zhao, Chaochao Lu, Shuai Li, Ricardo Henao"
HA-ViD: A Human Assembly Video Dataset for Comprehensive Assembly Knowledge Understanding,https://openreview.net/forum?id=DILUIcDmU9,"Hao Zheng, Regina Lee, Yuqian Lu"
Feature Selection in the Contrastive Analysis Setting,https://openreview.net/forum?id=RhE01dqo8u,"Ethan Weinberger, Ian Covert, Su-In Lee"
The noise level in linear regression with dependent data,https://openreview.net/forum?id=swNtr6vGqg,"Ingvar Ziemann, Stephen Tu, George J. Pappas, Nikolai Matni"
Fractal Landscapes in Policy Optimization,https://openreview.net/forum?id=QQidjdmyPp,"Tao Wang, Sylvia Herbert, Sicun Gao"
GeoDE: a Geographically Diverse Evaluation Dataset for Object Recognition,https://openreview.net/forum?id=JGVSxwKHbq,"Vikram V. Ramaswamy, Sing Yu Lin, Dora Zhao, Aaron Adcock, Laurens van der Maaten, Deepti Ghadiyaram, Olga Russakovsky"
Experimental Designs for Heteroskedastic Variance,https://openreview.net/forum?id=OFDApY678F,"Justin Weltz, Tanner Fiez, Alexander Volfovsky, Eric Laber, Blake Mason, houssam nassif, Lalit Jain"
Ignorance is Bliss: Robust Control via Information Gating,https://openreview.net/forum?id=tW2KSph9o8,"Manan Tomar, Riashat Islam, Matthew Taylor, Sergey Levine, Philip Bachman"
Learning to Influence Human Behavior with Offline Reinforcement Learning,https://openreview.net/forum?id=hzND3ZEFg2,"Joey Hong, Sergey Levine, Anca Dragan"
Scaling Data-Constrained Language Models,https://openreview.net/forum?id=j5BuTrEj35,"Niklas Muennighoff, Alexander Rush, Boaz Barak, Teven Le Scao, Nouamane Tazi, Aleksandra Piktus, Sampo Pyysalo, Thomas Wolf, Colin Raffel"
TD Convergence: An Optimization Perspective,https://openreview.net/forum?id=XOCbdqxAR2,"Kavosh Asadi, Shoham Sabach, Yao Liu, Omer Gottesman, Rasool Fakoor"
Budgeting Counterfactual for Offline RL,https://openreview.net/forum?id=1MUxtSBUox,"Yao Liu, Pratik Chaudhari, Rasool Fakoor"
Resetting the Optimizer in Deep RL: An Empirical Study,https://openreview.net/forum?id=AnFUgNC3Yc,"Kavosh Asadi, Rasool Fakoor, Shoham Sabach"
InfoCD: A Contrastive Chamfer Distance Loss for Point Cloud Completion,https://openreview.net/forum?id=w7LxAZfDfv,"Fangzhou Lin, Yun Yue, Ziming Zhang, Songlin Hou, Kazunori Yamada, Vijaya Kolachalama, Venkatesh Saligrama"
Conditional score-based diffusion models for Bayesian inference in infinite dimensions,https://openreview.net/forum?id=voG6nEW9BV,"Lorenzo Baldassari, Ali Siahkoohi, Josselin Garnier, Knut Solna, Maarten V. de Hoop"
Domain Adaptive Imitation Learning with Visual Observation,https://openreview.net/forum?id=GGbBXSkX3r,"Sungho Choi, Seungyul Han, Woojun Kim, Jongseong Chae, Whiyoung Jung, Youngchul Sung"
Landscape Surrogate: Learning Decision Losses for Mathematical Optimization Under Partial Information,https://openreview.net/forum?id=qyEm4tF2p1,"Arman Zharmagambetov, Brandon Amos, Aaron Ferber, Taoan Huang, Bistra Dilkina, Yuandong Tian"
Amazon-M2: A Multilingual Multi-locale Shopping Session Dataset for Recommendation and Text Generation,https://openreview.net/forum?id=uXBO47JcJT,"Wei Jin, Haitao Mao, Zheng Li, Haoming Jiang, Chen Luo, Hongzhi Wen, Haoyu Han, Hanqing Lu, Zhengyang Wang, Ruirui Li, Zhen Li, Monica Cheng, Rahul Goutam, Haiyang Zhang, Karthik Subbian, Suhang Wang, Yizhou Sun, Jiliang Tang, Bing Yin, Xianfeng Tang"
Scaling Riemannian Diffusion Models,https://openreview.net/forum?id=FLTg8uA5xI,"Aaron Lou, Minkai Xu, Adam Farris, Stefano Ermon"
Is This Loss Informative? Faster Text-to-Image Customization by Tracking Objective Dynamics,https://openreview.net/forum?id=Xs6Xwc0Glj,"Anton Voronov, Mikhail Khoroshikh, Artem Babenko, Max Ryabinin"
The Quantization Model of Neural Scaling,https://openreview.net/forum?id=3tbTw2ga8K,"Eric Michaud, Ziming Liu, Uzay Girit, Max Tegmark"
What You See is What You Read? Improving Text-Image Alignment Evaluation,https://openreview.net/forum?id=j5AoleAIru,"Michal Yarom, Yonatan Bitton, Soravit Changpinyo, Roee Aharoni, Jonathan Herzig, Oran Lang, Eran Ofek, Idan Szpektor"
VisIT-Bench: A Dynamic Benchmark for Evaluating Instruction-Following Vision-and-Language Models,https://openreview.net/forum?id=Y4GZ2w74f4,"Yonatan Bitton, Hritik Bansal, Jack Hessel, Rulin Shao, Wanrong Zhu, Anas Awadalla, Josh Gardner, Rohan Taori, Ludwig Schmidt"
Faster Relative Entropy Coding with Greedy Rejection Coding,https://openreview.net/forum?id=KXbAgvLi2l,"Gergely Flamich, Stratis Markou, José Miguel Hernández-Lobato"
ReTR: Modeling Rendering Via Transformer for Generalizable Neural Surface Reconstruction,https://openreview.net/forum?id=3ZICE99e6n,"Yixun Liang, Hao He, Yingcong Chen"
Multi-Step Generalized Policy Improvement by Leveraging Approximate Models,https://openreview.net/forum?id=KFj0Q1EXvU,"Lucas N. Alegre, Ana Bazzan, Ann Nowe, Bruno da Silva"
Bicriteria Approximation Algorithms for the Submodular Cover Problem,https://openreview.net/forum?id=iKarSI2a73,"Wenjing Chen, Victoria Crawford"
Learning Universal Policies via Text-Guided Video Generation,https://openreview.net/forum?id=bo8q5MRcwy,"Yilun Du, Sherry Yang, Bo Dai, Hanjun Dai, Ofir Nachum, Josh Tenenbaum, Dale Schuurmans, Pieter Abbeel"
Approximately Equivariant Graph Networks,https://openreview.net/forum?id=5aeyKAZr0L,"Ningyuan Huang, Ron Levie, Soledad Villar"
When Does Confidence-Based Cascade Deferral Suffice?,https://openreview.net/forum?id=4KZhZJSPYU,"Wittawat Jitkrittum, Neha Gupta, Aditya Menon, Harikrishna Narasimhan, Ankit Rawat, Sanjiv Kumar"
Hierarchical Randomized Smoothing,https://openreview.net/forum?id=6IhNHKyuJO,"Yan Scholten, Jan Schuchardt, Aleksandar Bojchevski, Stephan Günnemann"
"(Provable) Adversarial Robustness for Group Equivariant Tasks: Graphs, Point Clouds, Molecules, and More",https://openreview.net/forum?id=mLe63bAYc7,"Jan Schuchardt, Yan Scholten, Stephan Günnemann"
Real-World Image Variation by Aligning Diffusion Inversion Chain,https://openreview.net/forum?id=u6Ibs4hTJH,"Yuechen Zhang, Jinbo Xing, Eric Lo, Jiaya Jia"
Exploring and Interacting with the Set of Good Sparse Generalized Additive Models,https://openreview.net/forum?id=CzAAbKOHQW,"Chudi Zhong, Zhi Chen, Jiachang Liu, Margo Seltzer, Cynthia Rudin"
OpenLane-V2: A Topology Reasoning Benchmark for Unified 3D HD Mapping,https://openreview.net/forum?id=OMOOO3ls6g,"Huijie Wang, Tianyu Li, Yang Li, Li Chen, Chonghao Sima, Zhenbo Liu, Bangjun Wang, Peijin Jia, Yuting Wang, Shengyin Jiang, Feng Wen, Hang Xu, Ping Luo, Junchi Yan, Wei Zhang, Hongyang Li"
Leveraging Vision-Centric Multi-Modal Expertise for 3D Object Detection,https://openreview.net/forum?id=pQF9kbM8Ea,"Linyan Huang, Zhiqi Li, Chonghao Sima, Wenhai Wang, Jingdong Wang, Yu Qiao, Hongyang Li"
Contrast Everything: A Hierarchical Contrastive Framework for Medical Time-Series,https://openreview.net/forum?id=sOQBHlCmzp,"Yihe Wang, Yu Han, Haishuai Wang, Xiang Zhang"
EV-Eye: Rethinking High-frequency Eye Tracking through the Lenses of Event Cameras,https://openreview.net/forum?id=bmfMNIf1bU,"Guangrong Zhao, Yurun Yang, Jingwei Liu, Ning Chen, Yiran Shen, Hongkai Wen, Guohao Lan"
Towards a fuller understanding of neurons with Clustered Compositional Explanations,https://openreview.net/forum?id=51PLYhMFWz,"Biagio La Rosa, Leilani Gilpin, Roberto Capobianco"
DreamWaltz: Make a Scene with Complex 3D Animatable Avatars,https://openreview.net/forum?id=XGXL1E8Yyo,"Yukun Huang, Jianan Wang, Ailing Zeng, He CAO, Xianbiao Qi, Yukai Shi, Zheng-Jun Zha, Lei Zhang"
Efficient Adaptation of Large Vision Transformer via Adapter Re-Composing,https://openreview.net/forum?id=VbYdaK8ek0,"Wei Dong, Dawei Yan, Zhijun Lin, Peng Wang"
Trade-off Between Efficiency and Consistency for Removal-based Explanations,https://openreview.net/forum?id=MmCtXvW6GO,"Yifan Zhang, Haowei He, Zhiquan Tan, Yang Yuan"
Sorting with Predictions,https://openreview.net/forum?id=Qv7rWR9JWa,"Xingjian Bai, Christian Coester"
Bayesian Active Causal Discovery with Multi-Fidelity Experiments,https://openreview.net/forum?id=kS8rIH43Zc,"Zeyu Zhang, Chaozhuo Li, Xu Chen, Xing Xie"
NurViD: A Large Expert-Level Video Database for Nursing Procedure Activity Understanding,https://openreview.net/forum?id=tIW4kbnJIM,"Ming Hu, Lin Wang, Siyuan Yan, Don Ma, Qingli Ren, Peng Xia, Wei Feng, Peibo Duan, Lie Ju, Zongyuan Ge"
Mr. HiSum: A Large-scale Dataset for Video Highlight Detection and Summarization,https://openreview.net/forum?id=tz7XkY6S9Z,"Jinhwan Sul, Jihoon Han, Joonseok Lee"
Unsupervised Polychromatic Neural Representation for CT Metal Artifact Reduction,https://openreview.net/forum?id=xx3QgKyghS,"Qing Wu, Lixuan Chen, Ce Wang, Hongjiang Wei, S. Kevin Zhou, Jingyi Yu, Yuyao Zhang"
Rank-DETR for High Quality Object Detection,https://openreview.net/forum?id=WUott1ZvRj,"Yifan Pu, Weicong Liang, Yiduo Hao, YUHUI YUAN, Yukang Yang, Chao Zhang, Han Hu, Gao Huang"
FreeMask: Synthetic Images with Dense Annotations Make Stronger Segmentation Models,https://openreview.net/forum?id=XOotfgPiUF,"Lihe Yang, Xiaogang Xu, Bingyi Kang, Yinghuan Shi, Hengshuang Zhao"
Two Heads are Better Than One: A Simple Exploration Framework for Efficient Multi-Agent Reinforcement Learning,https://openreview.net/forum?id=AYLlZMmUbo,"Jiahui Li, Kun Kuang, Baoxiang Wang, Xingchen Li, Fei Wu, Jun Xiao, Long Chen"
Active Learning for Semantic Segmentation with Multi-class Label Query,https://openreview.net/forum?id=znudaK78u8,"Sehyun Hwang, Sohyun Lee, Hoyoung Kim, Minhyeon Oh, Jungseul Ok, Suha Kwak"
Saving 100x Storage: Prototype Replay for Reconstructing Training Sample Distribution in Class-Incremental Semantic Segmentation,https://openreview.net/forum?id=Ct0zPIe3xs,"Jinpeng Chen, Runmin Cong, Yuxuan LUO, Horace Ip, Sam Kwong"
Don’t Stop Pretraining? Make Prompt-based Fine-tuning Powerful Learner,https://openreview.net/forum?id=s7xWeJQACI,"Zhengxiang Shi, Aldo Lipani"
KuaiSim: A Comprehensive Simulator for Recommender Systems,https://openreview.net/forum?id=dJEjgQcbOt,"Kesen Zhao, Shuchang Liu, Qingpeng Cai, Xiangyu Zhao, Ziru Liu, Dong Zheng, Peng Jiang, Kun Gai"
The Geometry of Neural Nets' Parameter Spaces Under Reparametrization,https://openreview.net/forum?id=vtLNwa6uX0,"Agustinus Kristiadi, Felix Dangel, Philipp Hennig"
Learning Dictionary for Visual Attention,https://openreview.net/forum?id=exPzwOhBgx,"Yingjie Liu, Xuan Liu, Hui Yu, XUAN TANG, Xian Wei"
Characterizing Graph Datasets for Node Classification: Homophily-Heterophily Dichotomy and Beyond,https://openreview.net/forum?id=m7PIJWOdlY,"Oleg Platonov, Denis Kuznedelev, Artem Babenko, Liudmila Prokhorenkova"
Neural Algorithmic Reasoning Without Intermediate Supervision,https://openreview.net/forum?id=vBwSACOB3x,"Gleb Rodionov, Liudmila Prokhorenkova"
Learning Invariant Molecular Representation in Latent Discrete Space,https://openreview.net/forum?id=r9fzp8eyhZ,"Xiang Zhuang, Qiang Zhang, Keyan Ding, Yatao Bian, Xiao Wang, Jingsong Lv, Hongyang Chen, Huajun Chen"
"Waymax: An Accelerated, Data-Driven Simulator for Large-Scale Autonomous Driving Research",https://openreview.net/forum?id=7VSBaP2OXN,"Cole Gulino, Justin Fu, Wenjie Luo, George Tucker, Eli Bronstein, Yiren Lu, Jean Harb, Xinlei Pan, Yan Wang, Xiangyu Chen, John Co-Reyes, Rishabh Agarwal, Rebecca Roelofs, Yao Lu, Nico Montali, Paul Mougin, Zoey Yang, Brandyn White, Aleksandra Faust, Rowan McAllister, Dragomir Anguelov, Benjamin Sapp"
STXD: Structural and Temporal Cross-Modal Distillation for Multi-View 3D Object Detection,https://openreview.net/forum?id=Grz2ijKrWI,"Sujin Jang, Dae Ung Jo, Sung Ju Hwang, Dongwook Lee, Daehyun Ji"
OpenIllumination: A Multi-Illumination Dataset for Inverse Rendering Evaluation on Real Objects,https://openreview.net/forum?id=pRnrg2bWr0,"Isabella Liu, Linghao Chen, Ziyang Fu, Liwen Wu, Haian Jin, Zhong Li, Chin Ming Ryan Wong, Yi Xu, Ravi Ramamoorthi, Zexiang Xu, Hao Su"
Model-Free Reinforcement Learning with the Decision-Estimation Coefficient,https://openreview.net/forum?id=Ay3WvSrtpO,"Dylan J Foster, Noah Golowich, Jian Qian, Alexander Rakhlin, Ayush Sekhari"
When is Agnostic Reinforcement Learning Statistically Tractable?,https://openreview.net/forum?id=6gWpJ0IExE,"Zeyu Jia, Gene Li, Alexander Rakhlin, Ayush Sekhari, Nati Srebro"
"On the Variance, Admissibility, and Stability of Empirical Risk Minimization",https://openreview.net/forum?id=4KV2xLeqPN,"Gil Kur, Eli Putterman, Alexander Rakhlin"
Convergence of Adam Under Relaxed Assumptions,https://openreview.net/forum?id=yEewbkBNzi,"Haochuan Li, Alexander Rakhlin, Ali Jadbabaie"
Convex and Non-convex Optimization Under Generalized Smoothness,https://openreview.net/forum?id=8aunGrXdkl,"Haochuan Li, Jian Qian, Yi Tian, Alexander Rakhlin, Ali Jadbabaie"
SheetCopilot: Bringing Software Productivity to the Next Level through Large Language Models,https://openreview.net/forum?id=tfyr2zRVoK,"Hongxin Li, Jingran Su, Yuntao Chen, Qing Li, ZHAO-XIANG ZHANG"
Learning Multi-agent Behaviors from Distributed and Streaming Demonstrations,https://openreview.net/forum?id=Ou1VRZ4j4y,"Shicheng Liu, Minghui Zhu"
Provably Bounding Neural Network Preimages,https://openreview.net/forum?id=I50HbChk3U,"Suhas Kotha, Christopher Brix, J. Zico Kolter, Krishnamurthy Dvijotham, Huan Zhang"
Contextual Gaussian Process Bandits with Neural Networks,https://openreview.net/forum?id=eNhW9UnlGG,"Haoting Zhang, Jinghai He, Rhonda Righter, Zuo-Jun Shen, Zeyu Zheng"
Diverse Conventions for Human-AI Collaboration,https://openreview.net/forum?id=MljeRycu9s,"Bidipta Sarkar, Andy Shih, Dorsa Sadigh"
Explaining V1 Properties with a Biologically Constrained Deep Learning Architecture,https://openreview.net/forum?id=1uirUsR9E7,"Galen Pogoncheff, Jacob Granley, Michael Beyeler"
Human-in-the-Loop Optimization for Deep Stimulus Encoding in Visual Prostheses,https://openreview.net/forum?id=ZED5wdGous,"Jacob Granley, Tristan Fauvel, Matthew Chalk, Michael Beyeler"
ReMaX: Relaxing for Better Training on Efficient Panoptic Segmentation,https://openreview.net/forum?id=SaMrN9tnxE,"Shuyang Sun, WEIJUN WANG, Andrew Howard, Qihang Yu, Philip Torr, Liang-Chieh Chen"
Multi-Head Adapter Routing for Cross-Task Generalization,https://openreview.net/forum?id=qcQhBli5Ho,"Lucas Page-Caccia, Edoardo Maria Ponti, Zhan Su, Matheus Pereira, Nicolas Le Roux, Alessandro Sordoni"
What Do Deep Saliency Models Learn about Visual Attention?,https://openreview.net/forum?id=2rq4LwwjfE,"Shi Chen, Ming Jiang, Qi Zhao"
Are These the Same Apple? Comparing Images Based on Object Intrinsics,https://openreview.net/forum?id=pu3sNlrgQr,"Klemen Kotar, Stephen Tian, Hong-Xing Yu, Dan Yamins, Jiajun Wu"
"Adversarial Training for Graph Neural Networks: Pitfalls, Solutions, and New Directions",https://openreview.net/forum?id=GPtroppvUM,"Lukas Gosch, Simon Markus Geisler, Daniel Sturm, Bertrand Charpentier, Daniel Zügner, Stephan Günnemann"
How does GPT-2 compute greater-than?: Interpreting mathematical abilities in a pre-trained language model,https://openreview.net/forum?id=p4PckNQR8k,"Michael Hanna, Ollie Liu, Alexandre Variengien"
MiliPoint: A Point Cloud Dataset for mmWave Radar,https://openreview.net/forum?id=FpK2aQfbyo,"Han Cui, Shu Zhong, Jiacheng Wu, Zichao Shen, Naim Dahnoun, Yiren Zhao"
"Symmetry-Informed Geometric Representation for Molecules, Proteins, and Crystalline Materials",https://openreview.net/forum?id=ygXSNrIU1p,"Shengchao Liu, weitao Du, Yanjing Li, Zhuoxinran Li, Zhiling Zheng, Chenru Duan, Zhi-Ming Ma, Omar Yaghi, Animashree Anandkumar, Christian Borgs, Jennifer Chayes, Hongyu Guo, Jian Tang"
Energy Transformer,https://openreview.net/forum?id=MbwVNEx9KS,"Benjamin Hoover, Yuchen Liang, Bao Pham, Rameswar Panda, Hendrik Strobelt, Duen Horng Chau, Mohammed Zaki, Dmitry Krotov"
Energy-Based Sliced Wasserstein Distance,https://openreview.net/forum?id=umvV3yvo4N,"Khai Nguyen, Nhat Ho"
History Filtering in Imperfect Information Games: Algorithms and Complexity,https://openreview.net/forum?id=inIONNg8Sq,"Christopher Solinas, Doug Rebstock, Nathan Sturtevant, Michael Buro"
Graph Clustering with Graph Neural Networks,null,"Anton Tsitsulin, John Palowitch, Bryan Perozzi, Emmanuel Müller"
Cal-DETR: Calibrated Detection Transformer,https://openreview.net/forum?id=4SkPTD6XNP,"Muhammad Akhtar Munir, Salman Khan, Muhammad Haris Khan, Mohsen Ali, Fahad Shahbaz Khan"
Block-State Transformers,https://openreview.net/forum?id=XRTxIBs2eu,"Jonathan Pilault, Mahan Fathi, Orhan Firat, Chris Pal, Pierre-Luc Bacon, Ross Goroshin"
Rethinking Bias Mitigation: Fairer Architectures Make for Fairer Face Recognition,https://openreview.net/forum?id=1vzF4zWQ1E,"Samuel Dooley, Rhea Sukthanker, John Dickerson, Colin White, Frank Hutter, Micah Goldblum"
ForecastPFN: Synthetically-Trained Zero-Shot Forecasting,https://openreview.net/forum?id=tScBQRNgjk,"Samuel Dooley, Gurnoor Singh Khurana, Chirag Mohapatra, Siddartha V Naidu, Colin White"
On the Robustness of Removal-Based Feature Attributions,https://openreview.net/forum?id=b60wLlkBta,"Chris Lin, Ian Covert, Su-In Lee"
Attentive Transfer Entropy to Exploit Transient Emergence of Coupling Effect,https://openreview.net/forum?id=JpU5YmMKx7,"Xiaolei Ru, XINYA ZHANG, Zijia Liu, Jack Murdoch Moore, Gang Yan"
MIM4DD: Mutual Information Maximization for Dataset Distillation,https://openreview.net/forum?id=TZtw5YgxTE,"Yuzhang Shang, Zhihang Yuan, Yan Yan"
Auxiliary Losses for Learning Generalizable Concept-based Models,https://openreview.net/forum?id=jvYXln6Gzn,"Ivaxi Sheth, Samira Ebrahimi Kahou"
Localized Symbolic Knowledge Distillation for Visual Commonsense Models,https://openreview.net/forum?id=V5eG47pyVl,"Jae Sung Park, Jack Hessel, Khyathi Chandu, Paul Pu Liang, Ximing Lu, Peter West, Youngjae Yu, Qiuyuan Huang, Jianfeng Gao, Ali Farhadi, Yejin Choi"
Efficient Meta Neural Heuristic for Multi-Objective Combinatorial Optimization,https://openreview.net/forum?id=593fc38lhN,"Jinbiao Chen, Jiahai Wang, Zizhen Zhang, Zhiguang Cao, Te Ye, Siyuan Chen"
Learning a 1-layer conditional generative model in total variation,https://openreview.net/forum?id=wImYhdu4VF,"Ajil Jalal, Justin Kang, Ananya Uppal, Kannan Ramchandran, Eric Price"
Passive learning of active causal strategies in agents and language models,https://openreview.net/forum?id=BRpi8YAfac,"Andrew Lampinen, Stephanie Chan, Ishita Dasgupta, Andrew Nam, Jane Wang"
Discovering General Reinforcement Learning Algorithms with Adversarial Environment Design,https://openreview.net/forum?id=kAU6Cdq1gV,"Matthew T Jackson, Minqi Jiang, Jack Parker-Holder, Risto Vuorio, Chris Lu, Greg Farquhar, Shimon Whiteson, Jakob Foerster"
