title,openreview_link,authors
Worst-case Performance of Popular Approximate Nearest Neighbor Search Implementations: Guarantees and Limitations,https://openreview.net/forum?id=oKqaWlEfjY,"Piotr Indyk, Haike Xu"
Sampling from Gaussian Process Posteriors using Stochastic Gradient Descent,https://openreview.net/forum?id=Sf9goJtTCE,"Jihao Andreas Lin, Javier Antorán, Shreyas Padhy, David Janz, José Miguel Hernández-Lobato, Alexander Terenin"
Optimistic Exploration in Reinforcement Learning Using Symbolic Model Estimates,https://openreview.net/forum?id=Sf17j2pkCU,"Sarath Sreedharan, Michael Katz"
DiT-3D: Exploring Plain Diffusion Transformers for 3D Shape Generation,https://openreview.net/forum?id=Se71ks7Mfz,"Shentong Mo, Enze Xie, Ruihang Chu, Lanqing Hong, Matthias Niessner, Zhenguo Li"
Learning to Parameterize Visual Attributes for Open-set Fine-grained Retrieval,https://openreview.net/forum?id=SaII5qMgKH,"Shijie Wang, Jianlong Chang, Haojie Li, Zhihui Wang, Wanli Ouyang, Qi Tian"
Improving CLIP Training with Language Rewrites,https://openreview.net/forum?id=SVjDiiVySh,"Lijie Fan, Dilip Krishnan, Phillip Isola, Dina Katabi, Yonglong Tian"
Language Models Meet World Models: Embodied Experiences Enhance Language Models,https://openreview.net/forum?id=SVBR6xBaMl,"Jiannan Xiang, Tianhua Tao, Yi Gu, Tianmin Shu, Zirui Wang, Zichao Yang, Zhiting Hu"
Cognitive Model Discovery via Disentangled RNNs,https://openreview.net/forum?id=SOEF0i0G1z,"Kevin Miller, Maria Eckstein, Matt Botvinick, Zeb Kurth-Nelson"
PLANNER: Generating Diversified Paragraph via Latent Language Diffusion Model,https://openreview.net/forum?id=SLwy8UVS8Y,"Yizhe Zhang, Jiatao Gu, Zhuofeng Wu, Shuangfei Zhai, Joshua Susskind, Navdeep Jaitly"
Distributional Model Equivalence for Risk-Sensitive Reinforcement Learning,https://openreview.net/forum?id=SLTQluG80x,"Tyler Kastner, Murat Erdogdu, Amir-massoud Farahmand"
The Clock and the Pizza: Two Stories in Mechanistic Explanation of Neural Networks,https://openreview.net/forum?id=S5wmbQc1We,"Ziqian Zhong, Ziming Liu, Max Tegmark, Jacob Andreas"
Transportability for Bandits with Data from Different Environments,https://openreview.net/forum?id=S2k5dBb91q,"Alexis Bellot, Alan Malek, Silvia Chiappa"
A Partially-Supervised Reinforcement Learning Framework for Visual Active Search,https://openreview.net/forum?id=Rs6pzz21U4,"Anindya Sarkar, Nathan Jacobs, Yevgeniy Vorobeychik"
Exposing flaws of generative model evaluation metrics and their unfair treatment of diffusion models,https://openreview.net/forum?id=08zf7kTOoh,"George Stein, Jesse Cresswell, Rasa Hosseinzadeh, Yi Sui, Brendan Ross, Valentin Villecroze, Zhaoyan Liu, Anthony Caterini, Eric Taylor, Gabriel Loaiza-Ganem"
Partial Label Learning with Dissimilarity Propagation guided Candidate Label Shrinkage,https://openreview.net/forum?id=0CbmvZPBGB,"Yuheng Jia, Fuchao Yang, Yongqiang Dong"
Multi-Agent Meta-Reinforcement Learning: Sharper Convergence Rates with Task Similarity,https://openreview.net/forum?id=0Iw2dLh8uq,"Weichao Mao, Haoran Qiu, Chen Wang, Hubertus Franke, Zbigniew Kalbarczyk, Ravishankar Iyer, Tamer Basar"
Gaussian Mixture Solvers for Diffusion Models,https://openreview.net/forum?id=0NuseeBuB4,"Hanzhong Guo, Cheng Lu, Fan Bao, Tianyu Pang, Shuicheng Yan, Chao Du, Chongxuan LI"
Model Sparsity Can Simplify Machine Unlearning,https://openreview.net/forum?id=0jZH883i34,"jinghan jia, Jiancheng Liu, Parikshit Ram, Yuguang Yao, Gaowen Liu, Yang Liu, PRANAY SHARMA, Sijia Liu"
Collaborative Score Distillation for Consistent Visual Editing,https://openreview.net/forum?id=0tEjORCGFD,"Subin Kim, Kyungmin Lee, June Suk Choi, Jongheon Jeong, Kihyuk Sohn, Jinwoo Shin"
Lovász Principle for Unsupervised Graph Representation Learning,https://openreview.net/forum?id=0vdEHDwamk,"Ziheng Sun, Chris Ding, Jicong Fan"
Reusing Pretrained Models by Multi-linear Operators for Efficient Training,https://openreview.net/forum?id=RgNXKIrWyU,"Yu Pan, Ye Yuan, Yichun Yin, Zenglin Xu, Lifeng Shang, Xin Jiang, Qun Liu"
DeepPCR: Parallelizing Sequential Operations in Neural Networks,https://openreview.net/forum?id=RgD92idA32,"Federico Danieli, Miguel Sarabia, Xavier Suau Cuadros, Pau Rodriguez, Luca Zappella"
Expressive Sign Equivariant Networks for Spectral Geometric Learning,https://openreview.net/forum?id=UWd4ysACo4,"Derek Lim, Joshua Robinson, Stefanie Jegelka, Haggai Maron"
Federated Spectral Clustering via Secure Similarity Reconstruction,https://openreview.net/forum?id=RW7rZ8Y3Bp,"Dong Qiao, Chris Ding, Jicong Fan"
Spectral Invariant Learning for Dynamic Graphs under Distribution Shifts,https://openreview.net/forum?id=RRUVZygUtr,"Zeyang Zhang, Xin Wang, Ziwei Zhang, Zhou Qin, Weigao Wen, Hui Xue', Haoyang Li, Wenwu Zhu"
Towards Consistent Video Editing with Text-to-Image Diffusion Models,https://openreview.net/forum?id=RNVwm4BzXO,"Zicheng Zhang, Bonan Li, Xuecheng Nie, Congying Han, Tiande Guo, Luoqi Liu"
Optimizing over trained GNNs via symmetry breaking,https://openreview.net/forum?id=znW5jNIOED,"Shiqiang Zhang, Juan Campos, Christian Feldmann, David Walz, Frederik Sandfort, Miriam Mathea, Calvin Tsay, Ruth Misener"
Task-aware Distributed Source Coding under Dynamic Bandwidth,https://openreview.net/forum?id=1A4ZqTmnye,"Po-han Li, Sravan Kumar Ankireddy, Ruihan (Philip) Zhao, Hossein Nourkhiz Mahjoub, Ehsan Moradi Pari, Ufuk Topcu, Sandeep Chinchali, Hyeji Kim"
"Large language models transition from integrating across position-yoked, exponential windows to structure-yoked, power-law windows",https://openreview.net/forum?id=1EYKYJeZtR,"David Skrill, Samuel Norman-Haignere"
Learning and Collusion in Multi-unit Auctions,https://openreview.net/forum?id=1HKJ3lPz6m,"Simina Branzei, Mahsa Derakhshan, Negin Golrezaei, Yanjun Han"
A Theoretical Analysis of Optimistic Proximal Policy Optimization in Linear Markov Decision Processes,https://openreview.net/forum?id=1bTG4sJ7tN,"Han Zhong, Tong Zhang"
Beyond Black-Box Advice: Learning-Augmented Algorithms for MDPs with Q-Value Predictions,https://openreview.net/forum?id=RACcp8Zbr9,"Tongxin Li, Yiheng Lin, Shaolei Ren, Adam Wierman"
Learning Unseen Modality Interaction,https://openreview.net/forum?id=1g0A9kE8Id,"Yunhua Zhang, Hazel Doughty, Cees Snoek"
Energy Discrepancies: A Score-Independent Loss for Energy-Based Models,https://openreview.net/forum?id=1qFnxhdbxg,"Tobias Schröder, Zijing Ou, Jen Lim, Yingzhen Li, Sebastian Vollmer, Andrew Duncan"
Is Your Code Generated by ChatGPT Really Correct? Rigorous Evaluation of Large Language Models for Code Generation,https://openreview.net/forum?id=1qvx610Cu7,"Jiawei Liu, Chunqiu Steven Xia, Yuyao Wang, LINGMING ZHANG"
Hierarchical VAEs provide a normative account of motion processing in the primate brain,https://openreview.net/forum?id=1wOkHN9JK8,"Hadi Vafaii, Jacob Yates, Daniel Butts"
DiffuseBot: Breeding Soft Robots With Physics-Augmented Generative Diffusion Models,https://openreview.net/forum?id=1zo4iioUEs,"Tsun-Hsuan Johnson Wang, Juntian Zheng, Pingchuan Ma, Yilun Du, Byungchul Kim, Andrew Spielberg, Josh Tenenbaum, Chuang Gan, Daniela Rus"
Equal Opportunity of Coverage in Fair Regression,https://openreview.net/forum?id=QxYzmYmQQe,"Fangxin Wang, Lu Cheng, Ruocheng Guo, Kay Liu, Philip S Yu"
Going beyond persistent homology using persistent homology,https://openreview.net/forum?id=27TdrEvqLD,"Johanna Immonen, Amauri Souza, Vikas Garg"
Solving Inverse Physics Problems with Score Matching,https://openreview.net/forum?id=2BpoGPSDCR,"Benjamin Holzschuh, Simona Vegetti, Nils Thuerey"
DOSE: Diffusion Dropout with Adaptive Prior for Speech Enhancement,https://openreview.net/forum?id=2C2WZfCfo9,"Wenxin Tai, Yue Lei, Fan Zhou, Goce Trajcevski, Ting Zhong"
Streaming Factor Trajectory Learning for Temporal Tensor Decomposition,https://openreview.net/forum?id=Qu6Ln7d9df,"Shikai Fang, Xin Yu, Shibo Li, Zheng Wang, Mike Kirby, Shandian Zhe"
Bilevel Coreset Selection in Continual Learning: A New Formulation and Algorithm,https://openreview.net/forum?id=2dtU9ZbgSN,"Jie Hao, Kaiyi Ji, Mingrui Liu"
Learning Invariant Representations with a Nonparametric Nadaraya-Watson Head,https://openreview.net/forum?id=2ePf1sBgLU,"Alan Wang, Minh Nguyen, Mert Sabuncu"
Goal-conditioned Offline Planning from Curious Exploration,https://openreview.net/forum?id=QlbZabgMdK,"Marco Bagatella, Georg Martius"
Memory-Efficient Fine-Tuning of Compressed Large Language Models via sub-4-bit Integer Quantization,https://openreview.net/forum?id=2jUKhUrBxP,"Jeonghoon Kim, Jung Hyun Lee, Sungdong Kim, Joonsuk Park, Kang Min Yoo, Se Jung Kwon, Dongsoo Lee"
Weakly-Supervised Concealed Object Segmentation with SAM-based Pseudo Labeling and Multi-scale Feature Grouping,https://openreview.net/forum?id=QlHosp050r,"Chunming He, Kai Li, Yachao Zhang, Guoxia Xu, Longxiang Tang, Yulun Zhang, Zhenhua Guo, Xiu Li"
CoDA: Collaborative Novel Box Discovery and Cross-modal Alignment for Open-vocabulary 3D Object Detection,https://openreview.net/forum?id=QW5ouyyIgG,"Yang Cao, Zeng Yihan, Hang Xu, Dan Xu"
SceneScape: Text-Driven Consistent Scene Generation,https://openreview.net/forum?id=NU2kGsA4TT,"Rafail Fridman, Amit Abecasis, Yoni Kasten, Tali Dekel"
Evolving Connectivity for Recurrent Spiking Neural Networks,https://openreview.net/forum?id=30o4ARmfC3,"Guan Wang, Yuhao Sun, Sijie Cheng, Sen Song"
Explore to Generalize in Zero-Shot RL,https://openreview.net/forum?id=37cADkATD0,"Ev Zisselman, Itai Lavie, Daniel Soudry, Aviv Tamar"
CADet: Fully Self-Supervised Out-Of-Distribution Detection With Contrastive Learning,https://openreview.net/forum?id=QRAS5wSgEy,"Charles Guille-Escuret, Pau Rodriguez, David Vazquez, Ioannis Mitliagkas, Joao Monteiro"
Adversarial Self-Training Improves Robustness and Generalization for Gradual Domain Adaptation,https://openreview.net/forum?id=QNUs3Ramad,"Lianghe Shi, Weiwei Liu"
An Optimal and Scalable Matrix Mechanism for Noisy Marginals under Convex Loss Functions,https://openreview.net/forum?id=QKSejqE8Vp,"Yingtai Xiao, Guanlin He, Danfeng Zhang, Daniel Kifer"
Why Does Sharpness-Aware Minimization Generalize Better Than SGD?,https://openreview.net/forum?id=3WAnGWLpSQ,"Zixiang Chen, Junkai Zhang, Yiwen Kou, Xiangning Chen, Cho-Jui Hsieh, Quanquan Gu"
Federated Compositional Deep AUC Maximization,https://openreview.net/forum?id=tF7W8ai8J3,"Xinwen Zhang, Yihan Zhang, Tianbao Yang, Richard Souvenir, Hongchang Gao"
Direct Diffusion Bridge using Data Consistency for Inverse Problems,https://openreview.net/forum?id=497CevPdOg,"Hyungjin Chung, Jeongsol Kim, Jong Chul Ye"
Nearly Tight Bounds For Differentially Private Multiway Cut,https://openreview.net/forum?id=QDByreuQyk,"Mina Dalirrooyfard, Slobodan Mitrovic, Yuriy Nevmyvaka"
Direction-oriented Multi-objective Learning: Simple and Provable Stochastic Algorithms,https://openreview.net/forum?id=4Ks8RPcXd9,"Peiyao Xiao, Hao Ban, Kaiyi Ji"
High Precision Causal Model Evaluation with Conditional Randomization,https://openreview.net/forum?id=4PkBhz18in,"Chao Ma, Cheng Zhang"
Fast and Simple Spectral Clustering in Theory and Practice,https://openreview.net/forum?id=Q3FXnCPZ1X,Peter Macgregor
Binary Classification with Confidence Difference,https://openreview.net/forum?id=4RoD1o7yq6,"Wei Wang, Lei Feng, Yuchen Jiang, Gang Niu, Min-Ling Zhang, Masashi Sugiyama"
Make the U in UDA Matter: Invariant Consistency Learning for Unsupervised Domain Adaptation,https://openreview.net/forum?id=4hYIxI8ds0,"Zhongqi Yue, QIANRU SUN, Hanwang Zhang"
Does Visual Pretraining Help End-to-End Reasoning?,https://openreview.net/forum?id=PzYAMXmIT3,"Chen Sun, Calvin Luo, Xingyi Zhou, Anurag Arnab, Cordelia Schmid"
Quantifying the Cost of Learning in Queueing Systems,https://openreview.net/forum?id=54hYifmQZU,"Daniel Freund, Thodoris Lykouris, Wentao Weng"
Reward-Directed Conditional Diffusion: Provable Distribution Estimation and Reward Improvement,https://openreview.net/forum?id=58HwnnEdtF,"Hui Yuan, Kaixuan Huang, Chengzhuo Ni, Minshuo Chen, Mengdi Wang"
The Shaped Transformer: Attention Models in the Infinite Depth-and-Width Limit,https://openreview.net/forum?id=PqfPjS9JRX,"Lorenzo Noci, Chuning Li, Mufan Li, Bobby He, Thomas Hofmann, Chris Maddison, Dan Roy"
A Spectral Algorithm for List-Decodable Covariance Estimation in Relative Frobenius Norm,https://openreview.net/forum?id=PpI7XvOXkF,"Ilias Diakonikolas, Daniel Kane, Jasper Lee, Ankit Pensia, Thanasis Pittas"
Goal Driven Discovery of Distributional Differences via Language Descriptions,https://openreview.net/forum?id=PnbCA4ylIc,"Ruiqi Zhong, Peter Zhang, Steve Li, Jinwoo Ahn, Dan Klein, Jacob Steinhardt"
A Spectral Theory of Neural Prediction and Alignment,https://openreview.net/forum?id=5B1ZK60jWn,"Abdulkadir Canatar, Jenelle Feather, Albert Wakhloo, SueYeon Chung"
Truncating Trajectories in Monte Carlo Policy Evaluation: an Adaptive Approach,https://openreview.net/forum?id=PkKpTK7hJ6,"Riccardo Poiani, Nicole Nobili, Alberto Maria Metelli, Marcello Restelli"
Learning Fine-grained View-Invariant Representations from Unpaired Ego-Exo Videos via Temporal Alignment,https://openreview.net/forum?id=Pj6X6GqNy8,"Zihui (Sherry) Xue, Kristen Grauman"
"Squeeze, Recover and Relabel: Dataset Condensation at ImageNet Scale From A New Perspective",https://openreview.net/forum?id=5Fgdk3hZpb,"Zeyuan Yin, Eric Xing, Zhiqiang Shen"
Global Optimality in Bivariate Gradient-based DAG Learning,https://openreview.net/forum?id=5MG5C5aS6m,"Chang Deng, Kevin Bello, Pradeep Ravikumar, Bryon Aragam"
"Inconsistency, Instability, and Generalization Gap of Deep Neural Network Training",https://openreview.net/forum?id=5SIz31OGFV,"Rie Johnson, Tong Zhang"
Behavior Alignment via Reward Function Optimization,https://openreview.net/forum?id=PfpAQuyZCB,"Dhawal Gupta, Yash Chandak, Scott Jordan, Philip Thomas, Bruno da Silva"
Replicable Clustering,https://openreview.net/forum?id=5VQFAvUHcd,"Hossein Esfandiari, Amin Karbasi, Vahab Mirrokni, Grigoris Velegkas, Felix Zhou"
Tree of Thoughts: Deliberate Problem Solving with Large Language Models,https://openreview.net/forum?id=5Xc1ecxO1h,"Shunyu Yao, Dian Yu, Jeffrey Zhao, Izhak Shafran, Tom Griffiths, Yuan Cao, Karthik Narasimhan"
"Revisiting Adversarial Training for ImageNet: Architectures, Training and Generalization across Threat Models",https://openreview.net/forum?id=Pbpk9jUzAi,"Naman Deep Singh, Francesco Croce, Matthias Hein"
Interpretable and Explainable Logical Policies via Neurally Guided Symbolic Abstraction,https://openreview.net/forum?id=PbMBfRpVgU,"Quentin Delfosse, Hikaru Shindo, Devendra Dhami, Kristian Kersting"
No Representation Rules Them All in Category Discovery,https://openreview.net/forum?id=5ytypAqAsR,"Sagar Vaze, Andrea Vedaldi, Andrew Zisserman"
DDF-HO: Hand-Held Object Reconstruction via Conditional Directed Distance Field,https://openreview.net/forum?id=6EDHfVHicP,"Chenyangguang Zhang, Yan Di, Ruida Zhang, Guangyao Zhai, Fabian Manhardt, Federico Tombari, Xiangyang Ji"
Revisiting Scalarization in Multi-Task Learning: A Theoretical Perspective,https://openreview.net/forum?id=6EqUpqMnwl,"Yuzheng Hu, Ruicheng Xian, Qilong Wu, Qiuling Fan, Lang Yin, Han Zhao"
"Feature Learning for Interpretable, Performant Decision Trees",https://openreview.net/forum?id=PYEgC56flW,"Jack Good, Torin Kovach, Kyle Miller, Artur Dubrawski"
HAP: Structure-Aware Masked Image Modeling for Human-Centric Perception,https://openreview.net/forum?id=6XPPfZkhKi,"Junkun Yuan, Xinyu Zhang, Hao Zhou, Jian Wang, Zhongwei Qiu, Zhiyin Shao, Shaofeng Zhang, Sifan Long, Kun Kuang, Kun Yao, Junyu Han, Errui Ding, Lanfen Lin, Fei Wu, Jingdong Wang"
The Exact Sample Complexity Gain from Invariances for Kernel Regression,https://openreview.net/forum?id=6iouUxI45W,"Behrooz Tahmasebi, Stefanie Jegelka"
Causes and Effects of Unanticipated Numerical Deviations in Neural Network Inference Frameworks,https://openreview.net/forum?id=6zyFgr1b8Q,"Alex Schlögl, Nora Hofer, Rainer Böhme"
VPGTrans: Transfer Visual Prompt Generator across LLMs,https://openreview.net/forum?id=716PvHoDct,"Ao Zhang, Hao Fei, Yuan Yao, Wei Ji, Li Li, Zhiyuan Liu, Tat-Seng Chua"
Coop: Memory is not a Commodity,https://openreview.net/forum?id=gmmXyAq8TI,"Jianhao Zhang, Shihan Ma, Peihong Liu, Jinhui Yuan"
Structure of universal formulas,https://openreview.net/forum?id=gmVoaAxB1R,Dmitry Yarotsky
SimMTM: A Simple Pre-Training Framework for Masked Time-Series Modeling,https://openreview.net/forum?id=ginTcBUnL8,"Jiaxiang Dong, Haixu Wu, Haoran Zhang, Li Zhang, Jianmin Wang, Mingsheng Long"
Scaling Laws for Hyperparameter Optimization,https://openreview.net/forum?id=ghzEUGfRMD,"Arlind Kadra, Maciej Janowski, Martin Wistuba, Josif Grabocka"
Generalized equivalences between subsampling and ridge regularization,https://openreview.net/forum?id=7aoVQkNmQ6,"Pratik Patil, Jin-Hong Du"
Bias in Evaluation Processes: An Optimization-Based Model,https://openreview.net/forum?id=7b4oobeB4w,"L. Elisa Celis, Amit Kumar, Anay Mehrotra, Nisheeth K. Vishnoi"
Physics-Driven ML-Based Modelling for Correcting Inverse Estimation,https://openreview.net/forum?id=7h1YaSGaHS,"ruiyuan kang, Tingting Mu, Panagiotis Liatsis, Dimitrios Kyritsis"
Learning From Biased Soft Labels,https://openreview.net/forum?id=gevmGxsTSI,"Hua Yuan, Yu Shi, Ning Xu, Xu Yang, Xin Geng, Yong Rui"
ExPT: Synthetic Pretraining for Few-Shot Experimental Design,https://openreview.net/forum?id=7qfkImn0dL,"Tung Nguyen, Sudhanshu Agrawal, Aditya Grover"
Learning Robust Statistics for Simulation-based Inference under Model Misspecification,https://openreview.net/forum?id=STrXsSIEiq,"Daolang Huang, Ayush Bharti, Amauri Souza, Luigi Acerbi, Samuel Kaski"
Towards Optimal Caching and Model Selection for Large Model Inference,https://openreview.net/forum?id=gd20oaZqqF,"Banghua Zhu, Ying Sheng, Lianmin Zheng, Clark Barrett, Michael Jordan, Jiantao Jiao"
Entropy-based Training Methods for Scalable Neural Implicit Samplers,https://openreview.net/forum?id=lXOoR4KYcJ,"Weijian Luo, Boya Zhang, Zhihua Zhang"
Uncertainty Estimation for Safety-critical Scene Segmentation via Fine-grained Reward Maximization,https://openreview.net/forum?id=t9Swbo82dB,"Hongzheng Yang, Cheng Chen, Yueyao CHEN, Scheppach, Hon Chi Yip, DOU QI"
Tailoring Self-Attention for Graph via Rooted Subtrees,https://openreview.net/forum?id=t2hEZadBBk,"Siyuan Huang, Yunchong Song, Jiayue Zhou, Zhouhan Lin"
Not All Out-of-Distribution Data Are Harmful to Open-Set Active Learning,https://openreview.net/forum?id=lV3LIGlc1w,"Yang Yang, Yuxuan Zhang, XIN SONG, Yi Xu"
A unified framework for information-theoretic generalization bounds,https://openreview.net/forum?id=t0fkjO4aZj,"Yifeng Chu, Maxim Raginsky"
A Neural Collapse Perspective on Feature Evolution in Graph Neural Networks,https://openreview.net/forum?id=sxao2udWXi,"Vignesh Kothapalli, Tom Tirer, Joan Bruna"
Rewarded soups: towards Pareto-optimal alignment by interpolating weights fine-tuned on diverse rewards,https://openreview.net/forum?id=lSbbC2VyCu,"Alexandre Rame, Guillaume Couairon, Corentin Dancette, Jean-Baptiste Gaya, Mustafa Shukor, Laure Soulier, Matthieu Cord"
Is RLHF More Difficult than Standard RL? A Theoretical Perspective,https://openreview.net/forum?id=sxZLrBqg50,"Yuanhao Wang, Qinghua Liu, Chi Jin"
Explaining Predictive Uncertainty with Information Theoretic Shapley Values,https://openreview.net/forum?id=6rabAZhCRS,"David Watson, Joshua O'Hara, Niek Tax, Richard Mudd, Ido Guy"
Riemannian SAM: Sharpness-Aware Minimization on Riemannian Manifolds,https://openreview.net/forum?id=strvrjSi3C,"Jihun Yun, Eunho Yang"
Extensible Prompts for Language Models on Zero-shot Language Style Customization,https://openreview.net/forum?id=lRxpVfDMzz,"Tao Ge, Hu Jing, Li Dong, Shaoguang Mao, Yan Xia, Xun Wang, Si-Qing Chen, Furu Wei"
"The Simplicity Bias in Multi-Task RNNs: Shared Attractors, Reuse of Dynamics, and Geometric Representation",https://openreview.net/forum?id=stDm3S0CV7,"Elia Turner, Omri Barak"
Memory-Constrained Algorithms for Convex Optimization,https://openreview.net/forum?id=mkKQr56xdB,"Moise Blanchard, Junhui Zhang, Patrick Jaillet"
Self-Supervised Reinforcement Learning that Transfers using Random Features,https://openreview.net/forum?id=uRewSnLJAa,"Boyuan Chen, Chuning Zhu, Pulkit Agrawal, Kaiqing Zhang, Abhishek Gupta"
New Bounds for Hyperparameter Tuning of Regression Problems Across Instances,https://openreview.net/forum?id=8QGukmdAbh,"Maria-Florina Balcan, Anh Nguyen, Dravyansh Sharma"
Not All Neuro-Symbolic Concepts Are Created Equal: Analysis and Mitigation of Reasoning Shortcuts,https://openreview.net/forum?id=tLTtqySDFb,"Emanuele Marconato, Stefano Teso, Antonio Vergari, Andrea Passerini"
Hypothesis Selection with Memory Constraints,https://openreview.net/forum?id=lM1UnEssuX,"Maryam Aliakbarpour, Mark Bun, Adam Smith"
Unsupervised Semantic Correspondence Using Stable Diffusion,https://openreview.net/forum?id=sovxUzPzLN,"Eric Hedlin, Gopal Sharma, Shweta Mahajan, Hossam Isack, Abhishek Kar, Andrea Tagliasacchi, Kwang Moo Yi"
Reliable learning in challenging environments,https://openreview.net/forum?id=1h7Uh9zUXc,"Maria-Florina Balcan, Steve Hanneke, Rattana Pukdee, Dravyansh Sharma"
PDP: Parameter-free Differentiable Pruning is All You Need,https://openreview.net/forum?id=lLztVBaBVU,"Minsik Cho, Saurabh Adya, Devang Naik"
Unlimiformer: Long-Range Transformers with Unlimited Length Input,https://openreview.net/forum?id=lJWUJWLCJo,"Amanda Bertsch, Uri Alon, Graham Neubig, Matthew Gormley"
Cheap and Quick: Efficient Vision-Language Instruction Tuning for Large Language Models,https://openreview.net/forum?id=t877958UGZ,"Gen Luo, Yiyi Zhou, Tianhe Ren, Shengxin Chen, Xiaoshuai Sun, Rongrong Ji"
Dynamically Masked Discriminator for GANs,https://openreview.net/forum?id=sodl2c3aTM,"Wentian Zhang, Haozhe Liu, Bing Li, Jinheng Xie, Yawen Huang, Yuexiang Li, Yefeng Zheng, Bernard Ghanem"
Fast Attention Requires Bounded Entries,https://openreview.net/forum?id=KOVWXcrFIK,"Josh Alman, Zhao Song"
AV-NeRF: Learning Neural Fields for Real-World Audio-Visual Scene Synthesis,https://openreview.net/forum?id=snY3FOnlQi,"Susan Liang, Chao Huang, Yapeng Tian, Anurag Kumar, Chenliang Xu"
Data Market Design through Deep Learning,https://openreview.net/forum?id=sgCrNMOuXp,"Sai Srivatsa Ravindranath, Yanchen Jiang, David Parkes"
Retrieval-Augmented Multiple Instance Learning,https://openreview.net/forum?id=scaKiAtbI3,"Yufei CUI, Ziquan Liu, Yixin Chen, Yuchen Lu, Xinyue Yu, Xue (Steve) Liu, Tei-Wei Kuo, Miguel Rodrigues, Chun Jason XUE, Antoni Chan"
Normalization Layers Are All That Sharpness-Aware Minimization Needs,https://openreview.net/forum?id=lArwl3y9x6,"Maximilian Mueller, Tiffany Vlaar, David Rolnick, Matthias Hein"
Unleashing the Full Potential of Product Quantization for Large-Scale Image Retrieval,https://openreview.net/forum?id=scG0cwftEe,"Yu Liang, Shiliang Zhang, Li Ken Li, Xiaoyu Wang"
Unsupervised Learning for Solving the Travelling Salesman Problem,https://openreview.net/forum?id=lAEc7aIW20,"Yimeng Min, Yiwei Bai, Carla Gomes"
Visual Instruction Inversion: Image Editing via Image Prompting,https://openreview.net/forum?id=l9BsCh8ikK,"Thao Nguyen, Yuheng Li, Utkarsh Ojha, Yong Jae Lee"
Generative Category-level Object Pose Estimation via Diffusion Models,https://openreview.net/forum?id=l6ypbj6Nv5,"Jiyao Zhang, Mingdong Wu, Hao Dong"
Relative Entropic Optimal Transport: a (Prior-aware) Matching Perspective to (Unbalanced) Classification,https://openreview.net/forum?id=l61Kp1zBwC,"Liangliang Shi, Haoyu Zhen, Gu Zhang, Junchi Yan"
DiffPack: A Torsional Diffusion Model for Autoregressive Protein Side-Chain Packing,https://openreview.net/forum?id=sXMQPKbLXf,"Yangtian Zhang, Zuobai Zhang, Bozitao Zhong, Sanchit Misra, Jian Tang"
Weakly-Supervised Audio-Visual Segmentation,https://openreview.net/forum?id=sUqG96QqZM,"Shentong Mo, Bhiksha Raj"
NCDL:  A Framework for Deep Learning on non-Cartesian Lattices,https://openreview.net/forum?id=WBXYGBQXiB,"Joshua Horacsek, Usman Alim"
DDCoT: Duty-Distinct Chain-of-Thought Prompting for Multimodal Reasoning in Language Models,https://openreview.net/forum?id=ktYjrgOENR,"Ge Zheng, Bin Yang, Jiajin Tang, Hong-Yu Zhou, Sibei Yang"
Precise asymptotic generalization for multiclass classification with overparameterized linear models,https://openreview.net/forum?id=cRGINXQWem,"David Wu, Anant Sahai"
Multi-task learning with summary statistics,https://openreview.net/forum?id=ktTSji9ZIs,"Parker Knight, Rui Duan"
Projection-Free Online Convex Optimization via Efficient Newton Iterations,https://openreview.net/forum?id=sOOg1xJADA,"Khashayar Gatmiry, Zak Mhammedi"
SpatialRank: Urban Event Ranking with NDCG Optimization on Spatiotemporal Data,https://openreview.net/forum?id=ks7Mf5lzSx,"BANG AN, Xun Zhou, YONGJIAN ZHONG, Tianbao Yang"
On skip connections and normalisation layers in deep optimisation,https://openreview.net/forum?id=sLhXMkI0kx,"Lachlan MacDonald, Jack Valmadre, Hemanth Saratchandran, Simon Lucey"
Understanding Multi-phase Optimization Dynamics and Rich Nonlinear Behaviors of ReLU Networks,https://openreview.net/forum?id=konBXvt2iS,"Mingze Wang, Chao Ma"
Inverse Dynamics Pretraining Learns Good Representations for Multitask Imitation,https://openreview.net/forum?id=kjMGHTo8Cs,"David Brandfonbrener, Ofir Nachum, Joan Bruna"
DaTaSeg: Taming a Universal Multi-Dataset Multi-Task Segmentation Model,https://openreview.net/forum?id=kXOXrVnwbb,"Xiuye Gu, Yin Cui, Jonathan Huang, Abdullah Rashwan, Xuan Yang, Xingyi Zhou, Golnaz Ghiasi, Weicheng Kuo, Huizhong Chen, Liang-Chieh Chen, David Ross"
AND: Adversarial Neural Degradation for Learning Blind Image Super-Resolution,https://openreview.net/forum?id=s8QsYV1VZ2,"Fangzhou Luo, Xiaolin Wu, Yanhui Guo"
Online Ad Allocation with Predictions,https://openreview.net/forum?id=kPfd3pcwHV,"Fabian Spaeh, Alina Ene"
