title,openreview_link,authors
Constant Approximation for Individual Preference Stable Clustering,https://openreview.net/forum?id=8rDbUoYc0p,"Anders Aamand, Justin Chen, Allen Liu, Sandeep Silwal, Pattara Sukprasert, Ali Vakilian, Fred Zhang"
Self-Supervised Learning of Representations for Space Generates Multi-Modular Grid Cells,https://openreview.net/forum?id=8ox2vrQiTF,"Rylan Schaeffer, Mikail Khona, Tzuhsuan Ma, Cristobal Eyzaguirre, Sanmi Koyejo, Ila Fiete"
Investigating how ReLU-networks encode symmetries,https://openreview.net/forum?id=8lbFwpebeu,"Georg Bökman, Fredrik Kahl"
When Does Optimizing a Proper Loss Yield Calibration?,https://openreview.net/forum?id=8kyIChWsAG,"Jarosław Błasiok, Parikshit Gopalan, Lunjia Hu, Preetum Nakkiran"
A Riemannian Exponential Augmented Lagrangian Method for Computing the Projection Robust Wasserstein Distance,https://openreview.net/forum?id=8hKCNVqrlf,"Bo Jiang, Ya-Feng Liu"
Accurate Interpolation for Scattered Data through Hierarchical Residual Refinement,https://openreview.net/forum?id=8d9wVXri89,"Shizhe Ding, Boyang Xia, Dongbo Bu"
On the Convergence of Encoder-only Shallow Transformers,https://openreview.net/forum?id=8ZveVHfmIE,"Yongtao Wu, Fanghui Liu, Grigorios Chrysos, Volkan Cevher"
A Unified Discretization Framework for Differential Equation Approach with Lyapunov Arguments for Convex Optimization,https://openreview.net/forum?id=8YN62t19AW,"Kansei Ushiyama, Shun Sato, Takayasu Matsuo"
MixFormerV2: Efficient Fully Transformer Tracking,https://openreview.net/forum?id=8WvYAycmDJ,"Yutao Cui, Tianhui Song, Gangshan Wu, Limin Wang"
Learning Shared Safety Constraints from Multi-task Demonstrations,https://openreview.net/forum?id=8U31BCquNF,"Konwoo Kim, Gokul Swamy, ZUXIN LIU, DING ZHAO, Sanjiban Choudhury, Steven Wu"
Efficient Subgame Refinement for Extensive-form Games,https://openreview.net/forum?id=8HzOyg1ngp,"Zhenxing Ge, Zheng Xu, Tianyu Ding, Wenbin Li, Yang Gao"
Conservative State Value Estimation for Offline Reinforcement Learning,https://openreview.net/forum?id=8GSCaoFot9,"Liting Chen, Jie Yan, Zhengdao Shao, Lu Wang, Qingwei Lin, Saravanakumar Rajmohan, Thomas Moscibroda, Dongmei Zhang"
Exploiting Connections between Lipschitz Structures for Certifiably Robust Deep Equilibrium Models,https://openreview.net/forum?id=8F3Lutda7R,"Aaron Havens, Alexandre Araujo, Siddharth Garg, Farshad Khorrami, Bin Hu"
Tame a Wild Camera: In-the-Wild Monocular Camera Calibration,https://openreview.net/forum?id=898RcRYWCg,"Shengjie Zhu, Abhinav Kumar, Masa Hu, Xiaoming Liu"
Out-of-distribution Detection Learning with Unreliable Out-of-distribution Sources,https://openreview.net/forum?id=87Qnneer8l,"Haotian Zheng, Qizhou Wang, Zhen Fang, Xiaobo Xia, Feng Liu, Tongliang Liu, Bo Han"
Nearest Neighbour with Bandit Feedback,https://openreview.net/forum?id=86ADcKOHAw,"Stephen Pasteris, Chris Hicks, Vasilios Mavroudis"
One-step differentiation of iterative algorithms,https://openreview.net/forum?id=81snFfE3vR,"Jerome Bolte, Edouard Pauwels, Samuel Vaiter"
Fast Scalable and Accurate Discovery of DAGs Using the Best Order Score Search and Grow Shrink Trees,https://openreview.net/forum?id=80g3Yqlo1a,"Bryan Andrews, Joseph Ramsey, Ruben Sanchez Romero, Jazmin Camchong, Erich Kummerfeld"
A Simple Solution for Offline Imitation from Observations and Examples with Possibly Incomplete Trajectories,https://openreview.net/forum?id=805CW5w2CY,"Kai Yan, Alex Schwing, Yu-Xiong Wang"
A Theory of Multimodal Learning,https://openreview.net/forum?id=7xlrdSOm3g,Zhou Lu
Dis-inhibitory neuronal circuits can control the sign of synaptic plasticity,https://openreview.net/forum?id=7otRtfrRqo,"Julian Rossbroich, Friedemann Zenke"
A Theory of Link Prediction via Relational Weisfeiler-Leman on Knowledge Graphs,https://openreview.net/forum?id=7hLlZNrkt5,"Xingyue Huang, Miguel Romero, Ismail Ceylan, Pablo Barceló"
Unsupervised Optical Flow Estimation with Dynamic Timing Representation for Spike Camera,https://openreview.net/forum?id=7gbjsgcN5p,"Lujie Xia, Ziluo Ding, Rui Zhao, Jiyuan Zhang, Lei Ma, Zhaofei Yu, Tiejun Huang, Ruiqin Xiong"
Multi-Agent Learning with Heterogeneous Linear Contextual Bandits,https://openreview.net/forum?id=7f6vH3mmhr,"Anh Do, Thanh Nguyen-Tang, Raman Arora"
Information Maximizing Curriculum: A Curriculum-Based Approach for Learning Versatile Skills,https://openreview.net/forum?id=7eW6NzSE4g,"Denis Blessing, Onur Celik, Xiaogang Jia, Moritz Reuss, Maximilian Li, Rudolf Lioutikov, Gerhard Neumann"
Bucks for Buckets (B4B): Active Defenses Against Stealing Encoders,https://openreview.net/forum?id=NfpYgGZC3B,"Jan Dubiński, Stanisław Pawlak, Franziska Boenisch, Tomasz Trzcinski, Adam Dziedzic"
Reward-agnostic Fine-tuning: Provable Statistical Benefits of Hybrid Reinforcement Learning,https://openreview.net/forum?id=Nd3FennRJZ,"Gen Li, Wenhao Zhan, Jason Lee, Yuejie Chi, Yuxin Chen"
Intra-Modal Proxy Learning for Zero-Shot Visual Categorization with CLIP,https://openreview.net/forum?id=NXLjaYdgaL,"Qi Qian, Yuanhong Xu, Juhua Hu"
Efficient Low-rank Backpropagation for Vision Transformer Adaptation,https://openreview.net/forum?id=NNtsO5L27J,"Yuedong Yang, Hung-Yueh Chiang, Guihong Li, Diana Marculescu, Radu Marculescu"
To Stay or Not to Stay in the Pre-train Basin: Insights on Ensembling in Transfer Learning,https://openreview.net/forum?id=NNooZoQpP4,"Ildus Sadrtdinov, Dmitrii Pozdeev, Dmitry Vetrov, Ekaterina Lobacheva"
Extracting Reward Functions from Diffusion Models,https://openreview.net/forum?id=NN60HKTur2,"Felipe Nuti, Tim Franzmeyer, João Henriques"
Understanding the Limitations of Deep Models for Molecular property prediction: Insights and Solutions,https://openreview.net/forum?id=NLFqlDeuzt,"Jun Xia, Lecheng Zhang, Xiao Zhu, Yue Liu, Zhangyang Gao, Bozhen Hu, Cheng Tan, Jiangbin Zheng, Siyuan Li, Stan Z. Li"
Zero-sum Polymatrix Markov Games: Equilibrium Collapse and Efficient Computation of Nash Equilibria,https://openreview.net/forum?id=NGiq8qCQNk,"Fivos Kalogiannis, Ioannis Panageas"
Alternation makes the adversary weaker in two-player games,https://openreview.net/forum?id=NBMIsOS6B7,"Volkan Cevher, Ashok Cutkosky, Ali Kavis, Georgios Piliouras, Stratis Skoulakis, Luca Viano"
Online Learning under Adversarial Nonlinear Constraints,https://openreview.net/forum?id=N6YNe4KxDc,"Pavel Kolev, Georg Martius, Michael Muehlebach"
Random-Access Infinite Context Length for Transformers,https://openreview.net/forum?id=7eHn64wOVy,"Amirkeivan Mohtashami, Martin Jaggi"
Certification of Distributional Individual Fairness,https://openreview.net/forum?id=7cnMLZvTy9,"Matthew Wicker, Vihari Piratla, Adrian Weller"
Beyond Geometry: Comparing the Temporal Structure of Computation in Neural Circuits with Dynamical Similarity Analysis,https://openreview.net/forum?id=7blSUMwe7R,"Mitchell Ostrow, Adam Eisen, Leo Kozachkov, Ila Fiete"
Information Theoretic Lower Bounds for Information Theoretic Upper Bounds,https://openreview.net/forum?id=7anW5TWbCJ,Roi Livni
Joint processing of linguistic properties in brains and language models,https://openreview.net/forum?id=7WeCyYy9TL,"SUBBAREDDY OOTA, Manish Gupta, Mariya Toneva"
Statistical and Computational Trade-off in Multi-Agent Multi-Armed Bandits,https://openreview.net/forum?id=7PJ6LaIOO4,"Filippo Vannella, Alexandre Proutiere, Jaeseong Jeong"
Dual Self-Awareness Value Decomposition Framework without Individual Global Max for Cooperative MARL,https://openreview.net/forum?id=7LtzqnfuOs,"Zhiwei Xu, Bin Zhang, dapeng li, Guangchong Zhou, Zeren Zhang, Guoliang Fan"
Bounding training data reconstruction in DP-SGD,https://openreview.net/forum?id=7LZ4tZrYlx,"Jamie Hayes, Borja Balle, Saeed Mahloujifar"
Change point detection and inference in multivariate non-parametric models under mixing conditions,https://openreview.net/forum?id=7Fb2lCwS76,"Carlos Misael Madrid Padilla, Haotian Xu, Daren Wang, OSCAR HERNAN MADRID PADILLA, Yi Yu"
Exact Optimality of Communication-Privacy-Utility Tradeoffs in Distributed Mean Estimation,https://openreview.net/forum?id=7ETbK9lQd7,"Berivan Isik, Wei-Ning Chen, Ayfer Ozgur, Tsachy Weissman, Albert No"
Language Model Tokenizers Introduce Unfairness Between Languages,https://openreview.net/forum?id=78yDLKi95p,"Aleksandar Petrov, Emanuele La Malfa, Philip Torr, Adel Bibi"
IDEA: An Invariant Perspective for Efficient Domain Adaptive Image Retrieval,https://openreview.net/forum?id=77i6itptQW,"Haixin Wang, Hao Wu, Jinan Sun, Shikun Zhang, Chong Chen, Xian-Sheng Hua, Xiao Luo"
Fragment-based Pretraining and Finetuning on Molecular Graphs,https://openreview.net/forum?id=77Nq1KjmLl,"Kha-Dinh Luong, Ambuj K Singh"
Hierarchical clustering with dot products recovers hidden tree structure,https://openreview.net/forum?id=75v88kyyko,"Annie Gray, Alexander Modell, Patrick Rubin-Delanchy, Nick Whiteley"
No-Regret Learning in Dynamic Competition with Reference Effects Under Logit Demand,https://openreview.net/forum?id=75Mxzfoeq7,"Mengzi Amy Guo, Donghao Ying, Javad Lavaei, Zuo-Jun Shen"
PUe: Biased Positive-Unlabeled Learning Enhancement by Causal Inference,https://openreview.net/forum?id=6vtZIoxZoJ,"Xutao Wang, Hanting Chen, Tianyu Guo, Yunhe Wang"
Undirected Probabilistic Model for Tensor Decomposition,https://openreview.net/forum?id=3NWWgB2SuF,"Zerui Tao, Toshihisa Tanaka, Qibin Zhao"
HotBEV: Hardware-oriented Transformer-based Multi-View 3D Detector for BEV Perception,https://openreview.net/forum?id=3Cj67k38st,"Peiyan Dong, Zhenglun Kong, Xin Meng, Pinrui Yu, Yifan Gong, Geng Yuan, Hao Tang, Yanzhi Wang"
On the Last-iterate Convergence in Time-varying Zero-sum Games: Extra Gradient Succeeds where Optimism Fails,https://openreview.net/forum?id=3CJOaJugMG,"Yi Feng, Hu Fu, Qun Hu, Ping Li, Ioannis Panageas, bo peng, Xiao Wang"
Time-uniform confidence bands for the CDF under nonstationarity,https://openreview.net/forum?id=39cFjnRpYm,"Paul Mineiro, Steven Howard"
Im-Promptu: In-Context Composition from Image Prompts,https://openreview.net/forum?id=38o372YoYt,"Bhishma Dedhia, Michael Chang, Jake Snell, Tom Griffiths, Niraj Jha"
Equivariant Spatio-Temporal Attentive Graph Networks to Simulate Physical Dynamics,https://openreview.net/forum?id=35nFSbEBks,"Liming Wu, Zhichao Hou, Jirui Yuan, Yu Rong, Wenbing Huang"
Idempotent Learned Image Compression with Right-Inverse,https://openreview.net/forum?id=35dOU92OJM,"Yanghao Li, Tongda Xu, Yan Wang, Jingjing Liu, Ya-Qin Zhang"
Mutual Information Regularized Offline Reinforcement Learning,https://openreview.net/forum?id=2z8noau98f,"Xiao Ma, Bingyi Kang, Zhongwen Xu, Min Lin, Shuicheng Yan"
Double Auctions with Two-sided Bandit Feedback,https://openreview.net/forum?id=2nTpPxJ5Bs,"Soumya Basu, Abishek Sankararaman"
A Combinatorial Algorithm for Approximating the Optimal Transport in the Parallel and MPC Settings,https://openreview.net/forum?id=2izFpGERjU,"Nathaniel Lahn, Sharath Raghvendra, Kaiyi Zhang"
Neuro-symbolic Learning Yielding Logical Constraints,https://openreview.net/forum?id=2ioRi2uwLR,"Zenan Li, Yunpeng Huang, Zhaoyu Li, Yuan Yao, Jingwei Xu, Taolue Chen, Xiaoxing Ma, Jian Lu"
Estimating Propensity for Causality-based Recommendation without Exposure Data,https://openreview.net/forum?id=2hhIDEHhkk,"Zhongzhou Liu, Yuan Fang, Min Wu"
Efficient Online Clustering with Moving Costs,https://openreview.net/forum?id=2doqt9r0r0,"Dimitris Christou, Stratis Skoulakis, Volkan Cevher"
Robust Second-Order Nonconvex Optimization and Its Application to Low Rank Matrix Sensing,https://openreview.net/forum?id=2ccH4zjKVs,"Shuyao Li, Yu Cheng, Ilias Diakonikolas, Jelena Diakonikolas, Rong Ge, Stephen Wright"
Setting the Trap: Capturing and Defeating Backdoors in Pretrained Language Models through Honeypots,https://openreview.net/forum?id=2cYxNWNzk3,"Ruixiang Tang, Jiayi Yuan, Yiming Li, Zirui Liu, Rui Chen, Xia Hu"
Enhancing CLIP with CLIP: Exploring Pseudolabeling for Limited-Label Prompt Tuning,https://openreview.net/forum?id=2b9aY2NgXE,"Cristina Menghini, Andrew Delworth, Stephen Bach"
Structured Federated Learning through Clustered Additive Modeling,https://openreview.net/forum?id=2XT3UpOv48,"Jie Ma, Tianyi Zhou, Guodong Long, Jing Jiang, Chengqi Zhang"
Scaling laws for language encoding models in fMRI,https://openreview.net/forum?id=2W4LxJbgec,"Richard Antonello, Aditya Vaidya, Alexander Huth"
Revisiting Implicit Differentiation for Learning Problems in Optimal Control,https://openreview.net/forum?id=2URr3mkagy,"Ming Xu, Timothy L. Molloy, Stephen Gould"
On the Connection between Pre-training Data Diversity and Fine-tuning Robustness,https://openreview.net/forum?id=2SScUiWUbn,"Vivek Ramanujan, Thao Nguyen, Sewoong Oh, Ali Farhadi, Ludwig Schmidt"
Unifying Predictions of Deterministic and Stochastic Physics in Mesh-reduced Space with Sequential Flow Generative Model,https://openreview.net/forum?id=2JtwuJtoa0,"Luning Sun, Xu Han, Han Gao, Jian-Xun Wang, Liping Liu"
Learning to Compress Prompts with Gist Tokens,https://openreview.net/forum?id=2DtxPCL3T5,"Jesse Mu, Xiang Li, Noah Goodman"
Learning Functional Transduction,https://openreview.net/forum?id=2BFZ8cPIf6,"Mathieu Chalvidal, Thomas Serre, Rufin VanRullen"
"Comparing Causal Frameworks: Potential Outcomes, Structural Models, Graphs, and Abstractions",https://openreview.net/forum?id=1zKRwh5Rl2,"Duligur Ibeling, Thomas Icard"
Boosting with Tempered Exponential Measures,https://openreview.net/forum?id=1vvsIJtnnr,"Richard Nock, Ehsan Amid, Manfred Warmuth"
Decorate3D: Text-Driven High-Quality Texture Generation for Mesh Decoration in the Wild,https://openreview.net/forum?id=1recIOnzOF,"Yanhui Guo, Xinxin Zuo, Peng Dai, Juwei Lu, Xiaolin Wu, Li cheng, Youliang Yan, Songcen Xu, Xiaofei Wu"
Online Convex Optimization with Unbounded Memory,https://openreview.net/forum?id=1osmdAfD4P,"Raunak Kumar, Sarah Dean, Robert Kleinberg"
Exploring the Optimal Choice for Generative Processes in Diffusion Models: Ordinary vs Stochastic Differential Equations,https://openreview.net/forum?id=1mJQq6zYaE,"Yu Cao, Jingrun Chen, Yixin Luo, Xiang ZHOU"
Implicit Transfer Operator Learning: Multiple Time-Resolution Models for Molecular Dynamics,https://openreview.net/forum?id=1kZx7JiuA2,"Mathias Schreiner, Ole Winther, Simon Olsson"
Neural Sculpting: Uncovering hierarchically modular task structure in neural networks through pruning and network analysis,https://openreview.net/forum?id=1jhmWkZGy6,"Shreyas Malakarjun Patil, Loizos Michael, Constantine Dovrolis"
Find What You Want: Learning Demand-conditioned Object Attribute Space for Demand-driven Navigation,https://openreview.net/forum?id=1hZwxBgQ3G,"Hongcheng Wang, Andy Guan Hong Chen, Xiaoqi Li, Mingdong Wu, Hao Dong"
Unified Lower Bounds for Interactive High-dimensional Estimation under Information Constraints,https://openreview.net/forum?id=1ZzG6td0el,"Jayadev Acharya, Clément L Canonne, Ziteng Sun, Himanshu Tyagi"
Tanh Works Better with Asymmetry,https://openreview.net/forum?id=1WpmOipyYI,"Dongjin Kim, Woojeong Kim, Suhyun Kim"
Adaptive Topological Feature via Persistent Homology: Filtration Learning for Point Clouds,https://openreview.net/forum?id=1TJaITmK2Q,"Naoki Nishikawa, Yuichi Ike, Kenji Yamanishi"
Single-Stage Visual Query Localization in Egocentric Videos,https://openreview.net/forum?id=1SAzP7W43j,"Hanwen Jiang, Santhosh Kumar Ramakrishnan, Kristen Grauman"
Gaussian Partial Information Decomposition: Bias Correction and Application to High-dimensional Data,https://openreview.net/forum?id=1PnSOKQKvq,"Praveen Venkatesh, Corbett Bennett, Sam Gale, Tamina Ramirez, Greggory Heller, Severine Durand, Shawn Olsen, Stefan Mihalas"
How a Student becomes a Teacher: learning and forgetting through Spectral methods,https://openreview.net/forum?id=1FVmMlifl7,"Lorenzo Giambagli, Lorenzo Buffoni, Lorenzo Chicchi, Duccio Fanelli"
HeadSculpt: Crafting 3D Head Avatars with Text,https://openreview.net/forum?id=1DmP6ySKYq,"Xiao Han, Yukang Cao, Kai Han, Xiatian Zhu, Jiankang Deng, Yi-Zhe Song, Tao Xiang, Kwan-Yee K. Wong"
Instructing Goal-Conditioned Reinforcement Learning Agents with Temporal Logic Objectives,https://openreview.net/forum?id=19AgWnmyoV,"Wenjie Qiu, Wensen Mao, He Zhu"
Towards Understanding the Dynamics of Gaussian-Stein Variational Gradient Descent,https://openreview.net/forum?id=14ZM7FfPx8,"Tianle Liu, Promit Ghosal, Krishnakumar Balasubramanian, Natesh Pillai"
The Adversarial Consistency of Surrogate Risks for Binary Classification,https://openreview.net/forum?id=0uARg5G04K,"Natalie Frank, Jonathan Niles-Weed"
Graph Contrastive Learning with Stable and Scalable Spectral Encoding,https://openreview.net/forum?id=0kz5RmHxmE,"Deyu Bo, Yuan Fang, Yang Liu, Chuan Shi"
Improved Frequency Estimation Algorithms with and without Predictions,https://openreview.net/forum?id=0VcvYQ3uPh,"Anders Aamand, Justin Chen, Huy Nguyen, Sandeep Silwal, Ali Vakilian"
Pruning vs Quantization: Which is Better?,https://openreview.net/forum?id=0OU1ZXXxs5,"Andrey Kuzmin, Markus Nagel, Mart van Baalen, Arash Behboodi, Tijmen Blankevoort"
ScaleLong: Towards More Stable Training of Diffusion Model via Scaling Network Long Skip Connection,https://openreview.net/forum?id=0N73P8pH2l,"Zhongzhan Huang, Pan Zhou, Shuicheng Yan, Liang Lin"
Adaptive Uncertainty Estimation via High-Dimensional Testing on Latent Representations,https://openreview.net/forum?id=0DpKUzl1Se,"Tsai Hor Chan, Kin Wai Lau, Jiajun Shen, Guosheng Yin, Lequan Yu"
Task Arithmetic in the Tangent Space: Improved Editing of Pre-Trained Models,https://openreview.net/forum?id=0A9f2jZDGW,"Guillermo Ortiz-Jimenez, Alessandro Favero, Pascal Frossard"
Online Ad Procurement in Non-stationary Autobidding Worlds,https://openreview.net/forum?id=09bZyE9tfp,"Jason Cheuk Nam Liang, Haihao Lu, Baoyu Zhou"
On the Powerfulness of Textual Outlier Exposure for Visual OoD Detection,https://openreview.net/forum?id=090ORrOAPL,"Sangha Park, Jisoo Mok, Dahuin Jung, Saehyung Lee, Sungroh Yoon"
Exploiting hidden structures in non-convex games for convergence to Nash equilibrium,https://openreview.net/forum?id=05P1U0jk8r,"Iosif Sakos, Emmanouil-Vasileios Vlatakis-Gkaragkounis, Panayotis Mertikopoulos, Georgios Piliouras"
Complexity Matters: Rethinking the Latent Space for Generative Modeling,https://openreview.net/forum?id=00EKYYu3fD,"Tianyang Hu, Fei Chen, Haonan Wang, Jiawei Li, Wenjia Wang, Jiacheng Sun, Zhenguo Li"
Effective Targeted Attacks for Adversarial Self-Supervised Learning,https://openreview.net/forum?id=2f0dlMZlNb,"Minseon Kim, Hyeonjeong Ha, Sooel Son, Sung Ju Hwang"
Brain-like Flexible Visual Inference by Harnessing Feedback Feedforward Alignment,https://openreview.net/forum?id=DBlkX8Nczr,"Tahereh Toosi, Elias Issa"
Probabilistic Exponential Integrators,https://openreview.net/forum?id=2dx5MNs2Ip,"Nathanael Bosch, Philipp Hennig, Filip Tronarp"
Graph Convolutional Kernel Machine versus Graph Convolutional Networks,https://openreview.net/forum?id=SFfOt1oDsX,"Zhihao Wu, Zhao Zhang, Jicong Fan"
First Order Methods with Markovian Noise: from Acceleration to Variational Inequalities,https://openreview.net/forum?id=KMeFZopsqP,"Aleksandr Beznosikov, Sergey Samsonov, Marina Sheshukova, Alexander Gasnikov, Alexey Naumov, Eric Moulines"
Scalable Primal-Dual Actor-Critic Method for Safe Multi-Agent RL with General Utilities,https://openreview.net/forum?id=O63qgtebjH,"Donghao Ying, Yunkai Zhang, Yuhao Ding, Alec Koppel, Javad Lavaei"
Towards Efficient and Accurate Winograd Convolution via Full Quantization,https://openreview.net/forum?id=U4WTG06Yu3,"Tianqi Chen, Weixiang Xu, Weihan Chen, Peisong Wang, Jian Cheng"
Learning Efficient Coding of Natural Images with Maximum Manifold Capacity Representations,https://openreview.net/forum?id=og9V7NgOrQ,"Thomas Yerxa, Yilun Kuang, Eero Simoncelli, SueYeon Chung"
Conservative Offline Policy Adaptation in Multi-Agent Games,https://openreview.net/forum?id=C8pvL8Qbfa,"Chengjie Wu, Pingzhong Tang, Jun Yang, Yujing Hu, Tangjie Lv, Changjie Fan, Chongjie Zhang"
Locality Sensitive Hashing in Fourier Frequency Domain For Soft Set Containment Search,https://openreview.net/forum?id=rUf0GV5CuU,"Indradyumna Roy, Rishi Agarwal, Soumen Chakrabarti, Anirban Dasgupta, Abir De"
Computing Optimal Nash Equilibria in Multiplayer Games,https://openreview.net/forum?id=kupNhxLc6k,"Youzhi Zhang, Bo An, Venkatramanan Subrahmanian"
Class-Distribution-Aware Pseudo-Labeling for Semi-Supervised Multi-Label Learning,https://openreview.net/forum?id=UOB1UgPjuG,"Ming-Kun Xie, Jiahao Xiao, Hao-Zhe Liu, Gang Niu, Masashi Sugiyama, Sheng-Jun Huang"
Provable Guarantees for Nonlinear Feature Learning in Three-Layer Neural Networks,https://openreview.net/forum?id=fShubymWrc,"Eshaan Nichani, Alex Damian, Jason Lee"
Rethinking Semi-Supervised Medical Image Segmentation: A Variance-Reduction Perspective,https://openreview.net/forum?id=g9gjpFOiO4,"Chenyu You, Weicheng Dai, Yifei Min, Fenglin Liu, David Clifton, S. Kevin Zhou, Lawrence Staib, James Duncan"
Differentially Private Decoupled Graph Convolutions for Multigranular Topology Protection,https://openreview.net/forum?id=dd3KNayGFz,"Eli Chien, Wei-Ning Chen, Chao Pan, Pan Li, Ayfer Ozgur, Olgica Milenkovic"
Accountability in Offline Reinforcement Learning: Explaining Decisions with a Corpus of Examples,https://openreview.net/forum?id=kmbG9iBRIb,"Hao Sun, Alihan Hüyük, Daniel Jarrett, Mihaela van der Schaar"
Learning to Receive Help: Intervention-Aware Concept Embedding Models,https://openreview.net/forum?id=4ImZxqmT1K,"Mateo Espinosa Zarlenga, Katie Collins, Krishnamurthy Dvijotham, Adrian Weller, Zohreh Shams, Mateja Jamnik"
Text Promptable Surgical Instrument Segmentation with Vision-Language Models,https://openreview.net/forum?id=YwgA3avHrP,"Zijian Zhou, Oluwatosin Alabi, Meng Wei, Tom Vercauteren, Miaojing Shi"
Blocked Collaborative Bandits: Online Collaborative Filtering with Per-Item Budget Constraints,https://openreview.net/forum?id=Ntd6X7uWYF,"Soumyabrata Pal, Arun Suggala, Karthikeyan Shanmugam, Prateek Jain"
Adversarial Counterfactual Environment Model Learning,https://openreview.net/forum?id=rHAX0LRwk8,"Xiong-Hui Chen, Yang Yu, Zhengmao Zhu, ZhiHua Yu, Chen Zhenjun, Chenghe Wang, Yinan Wu, Rong-Jun Qin, Hongqiu Wu, Ruijin Ding, Huang Fangsheng"
Why Did This Model Forecast This Future? Information-Theoretic Saliency for Counterfactual Explanations of Probabilistic Regression Models,https://openreview.net/forum?id=IrEYkhuxup,"Chirag Raman, Alec Nonnemaker, Amelia Villegas-Morcillo, Hayley Hung, Marco Loog"
CL-NeRF: Continual Learning of Neural Radiance Fields for Evolving Scene Representation,https://openreview.net/forum?id=uZjpSBTPik,"Xiuzhe Wu, Peng Dai, Weipeng DENG, Handi Chen, Yang Wu, Yan-Pei Cao, Ying Shan, Xiaojuan Qi"
Latent Graph Inference with Limited Supervision,https://openreview.net/forum?id=tGuMwFnRZX,"Jianglin Lu, Yi Xu, Huan Wang, Yue Bai, Yun Fu"
Generalized Bayesian Inference for Scientific Simulators via Amortized Cost Estimation,https://openreview.net/forum?id=ZARAiV25CW,"Richard Gao, Michael Deistler, Jakob H Macke"
Incomplete Multimodality-Diffused Emotion Recognition,https://openreview.net/forum?id=BuGFwUS9B3,"Yuanzhi Wang, Yong Li, Zhen Cui"
A Fractional Graph Laplacian Approach to Oversmoothing,https://openreview.net/forum?id=kS7ED7eE74,"Sohir Maskey, Raffaele Paolino, Aras Bacho, Gitta Kutyniok"
"Lookaround Optimizer: $k$ steps around, 1 step average",https://openreview.net/forum?id=k1Xy5zCNOJ,"Jiangtao Zhang, Shunyu Liu, Jie Song, Tongtian Zhu, Zhengqi Xu, Mingli Song"
MEGABYTE: Predicting Million-byte Sequences with Multiscale Transformers,https://openreview.net/forum?id=JTmO2V9Xpz,"LILI YU, Daniel Simig, Colin Flaherty, Armen Aghajanyan, Luke Zettlemoyer, Mike Lewis"
Hyperbolic Graph Neural Networks at Scale: A Meta Learning Approach,https://openreview.net/forum?id=SHVwG9yOEk,"Nurendra Choudhary, Nikhil Rao, Chandan Reddy"
Efficiently incorporating quintuple interactions into geometric deep learning force fields,https://openreview.net/forum?id=bPJmu1PbZD,"Zun Wang, Guoqing Liu, Yichi Zhou, Tong Wang, Bin Shao"
Bayes beats Cross Validation: Efficient and Accurate Ridge Regression via Expectation Maximization,https://openreview.net/forum?id=Ih2yL7o2Gq,"Shu Yu Tew, Mario Boley, Daniel Schmidt"
GAN You See Me? Enhanced Data Reconstruction Attacks against Split Inference,https://openreview.net/forum?id=YZGWhs1H7F,"Ziang Li, Mengda Yang, Yaxin Liu, Juan Wang, Hongxin Hu, Wenzhe Yi, Xiaoyang Xu"
Volume Feature Rendering for Fast Neural Radiance Field Reconstruction,https://openreview.net/forum?id=3aVZhMfsyz,"Kang Han, Wei Xiang, Lu Yu"
Recaptured Raw Screen Image and Video Demoiréing via Channel and Spatial Modulations,https://openreview.net/forum?id=EkcO9tHm6S,"Yijia Cheng, Yijia Cheng, Xin Liu, Jingyu Yang"
“Why Not Looking backward?” A Robust Two-Step Method to Automatically Terminate Bayesian Optimization,https://openreview.net/forum?id=IMiGRqltQQ,"Shuang Li, Ke Li, Wei Li"
Optimizing Solution-Samplers for Combinatorial Problems: The Landscape of Policy-Gradient Method,https://openreview.net/forum?id=mmTy1iyU5G,"Constantine Caramanis, Dimitris Fotakis, Alkis Kalavasis, Vasilis Kontonis, Christos Tzamos"
SLaM: Student-Label Mixing for  Distillation with Unlabeled Examples,https://openreview.net/forum?id=N7tw0QXx3z,"Vasilis Kontonis, Fotis Iliopoulos, Khoa Trinh, Cenk Baykal, Gaurav Menghani, Erik Vee"
Domain Watermark: Effective and Harmless Dataset Copyright Protection is Closed at Hand,https://openreview.net/forum?id=PIDNxRRJ8w,"Junfeng Guo, Yiming Li, Lixu Wang, Shu-Tao Xia, Heng Huang, Cong Liu, Bo Li"
Transfer learning for atomistic simulations using GNNs and kernel mean embeddings,https://openreview.net/forum?id=Enzew8XujO,"John Falk, Luigi Bonati, Pietro Novelli, Michele Parrinello, Massimiliano Pontil"
