title,openreview_link,authors
Achieving Cross Modal Generalization with Multimodal Unified Representation,https://openreview.net/forum?id=t7ZowrDWVw,"Yan Xia, Hai Huang, Jieming Zhu, Zhou Zhao"
Adaptive Online Replanning with Diffusion Models,https://openreview.net/forum?id=jhs8F63xI6,"Siyuan Zhou, Yilun Du, Shun Zhang, Mengdi Xu, Yikang Shen, Wei Xiao, Dit-Yan Yeung, Chuang Gan"
A Comprehensive Benchmark for Neural Human Radiance Fields,https://openreview.net/forum?id=7kc4gtEk3b,"Kenkun Liu, Derong Jin, Ailing Zeng, Xiaoguang Han, Lei Zhang"
MMGP: a Mesh Morphing Gaussian Process-based machine learning method for regression of physical problems under nonparametrized geometrical variability,https://openreview.net/forum?id=Ca78M3awPw,"Fabien Casenave, Brian Staber, Xavier Roynard"
D-Separation for Causal Self-Explanation,https://openreview.net/forum?id=sUFGPYS25Q,"Wei Liu, Jun Wang, Haozhao Wang, Ruixuan Li, Zhiying Deng, YuanKai Zhang, Yang Qiu"
Learning Human Action Recognition Representations Without Real Humans,https://openreview.net/forum?id=UBbm5embIB,"Howard Zhong, Samarth Mishra, Donghyun Kim, SouYoung Jin, Rameswar Panda, Hilde Kuehne, Leonid Karlinsky, Venkatesh Saligrama, Aude Oliva, Rogerio Feris"
Bridging the Domain Gap: Self-Supervised 3D Scene Understanding with Foundation Models,https://openreview.net/forum?id=MJbDy2155j,"Zhimin Chen, Longlong Jing, Yingwei Li, Bing Li"
Generative Modeling through the Semi-dual Formulation of Unbalanced Optimal Transport,https://openreview.net/forum?id=7WQt1J13ex,"Jaemoo Choi, Jaewoong Choi, Myungjoo Kang"
Optimal Time Complexities of Parallel Stochastic Optimization Methods Under a Fixed Computation Model,https://openreview.net/forum?id=B4xF1wfQnF,"Alexander Tyurin, Peter Richtarik"
Implicit Contrastive Representation Learning with Guided Stop-gradient,https://openreview.net/forum?id=XUu2GloTXb,"Byeongchan Lee, Sehyun Lee"
A Computation and Communication Efficient Method for Distributed Nonconvex Problems in the Partial Participation Setting,https://openreview.net/forum?id=loxinzXlCx,"Alexander Tyurin, Peter Richtarik"
Contextually Affinitive Neighborhood Refinery for Deep Clustering,https://openreview.net/forum?id=Psj0jHocm1,"Chunlin Yu, Ye Shi, Jingya Wang"
2Direction: Theoretically Faster Distributed Training with Bidirectional Communication Compression,https://openreview.net/forum?id=n18MhTsSGb,"Alexander Tyurin, Peter Richtarik"
RL-based Stateful Neural Adaptive Sampling and Denoising for Real-Time Path Tracing,https://openreview.net/forum?id=xNyR7DXUzJ,"Antoine Scardigli, Lukas Cavigelli, Lorenz K. Müller"
Score-based Generative Modeling through Stochastic Evolution Equations in Hilbert Spaces,https://openreview.net/forum?id=GrElRvXnEj,"Sungbin Lim, EUN BI YOON, Taehyun Byun, Taewon Kang, Seungwoo Kim, Kyungjae Lee, Sungjoon Choi"
Score-based Generative Models with Lévy Processes,https://openreview.net/forum?id=0Wp3VHX0Gm,"EUN BI YOON, Keehun Park, Sungwoong Kim, Sungbin Lim"
Mix-of-Show: Decentralized Low-Rank Adaptation for Multi-Concept Customization of Diffusion Models,https://openreview.net/forum?id=NnIaEaBfXD,"Yuchao Gu, Xintao Wang, Jay Zhangjie Wu, Yujun Shi, Yunpeng Chen, Zihan Fan, WUYOU XIAO, Rui Zhao, Shuning Chang, Weijia Wu, Yixiao Ge, Ying Shan, Mike Zheng Shou"
MathNAS: If Blocks Have a Role in Mathematical Architecture Design,https://openreview.net/forum?id=e1l4ZYprQH,"Qinsi Wang, Jinghan Ke, Zhi Liang, Sihai Zhang"
Pre-training Contextualized World Models with In-the-wild Videos for Reinforcement Learning,https://openreview.net/forum?id=8GuEVzAUQS,"Jialong Wu, Haoyu Ma, Chaoyi Deng, Mingsheng Long"
ResShift: Efficient Diffusion Model for Image Super-resolution by Residual Shifting,https://openreview.net/forum?id=ZIyAHaLlsn,"Zongsheng Yue, Jianyi Wang, Chen Change Loy"
DatasetDM: Synthesizing Data with Perception Annotations Using Diffusion Models,https://openreview.net/forum?id=JIKM2vS8XU,"Weijia Wu, Yuzhong Zhao, Hao Chen, Yuchao Gu, Rui Zhao, Yefei He, Hong Zhou, Mike Zheng Shou, Chunhua Shen"
Your representations are in the network: composable and parallel adaptation for large scale models,https://openreview.net/forum?id=Ydxnan4P2G,"Yonatan Dukler, Alessandro Achille, Hao Yang, Varsha Vivek, Luca Zancato, Benjamin Bowman, Avinash Ravichandran, Charless Fowlkes, Ashwin Swaminathan, Stefano Soatto"
Parallel Sampling of Diffusion Models,https://openreview.net/forum?id=bpzwUfX1UP,"Andy Shih, Suneel Belkhale, Stefano Ermon, Dorsa Sadigh, Nima Anari"
Momentum Provably Improves Error Feedback!,https://openreview.net/forum?id=1h92PmnKov,"Ilyas Fatkhullin, Alexander Tyurin, Peter Richtarik"
Enhancing Adversarial Contrastive Learning via Adversarial Invariant Regularization,https://openreview.net/forum?id=zuXyQsXVLF,"Xilie Xu, Jingfeng ZHANG, Feng Liu, Masashi Sugiyama, Mohan Kankanhalli"
Efficient Adversarial Contrastive Learning via Robustness-Aware Coreset Selection,https://openreview.net/forum?id=fpzA8uRA95,"Xilie Xu, Jingfeng ZHANG, Feng Liu, Masashi Sugiyama, Mohan Kankanhalli"
Improving Diffusion-Based Image Synthesis with Context Prediction,https://openreview.net/forum?id=wRhLd65bDt,"Ling Yang, Jingwei Liu, Shenda Hong, Zhilong Zhang, Zhilin Huang, Zheming Cai, Wentao Zhang, Bin CUI"
XAGen: 3D Expressive Human Avatars Generation,https://openreview.net/forum?id=eUf0CaS5AP,"Zhongcong XU, Jianfeng Zhang, Jun Hao Liew, Jiashi Feng, Mike Zheng Shou"
Reinforcement-Enhanced Autoregressive Feature Transformation: Gradient-steered Search in Continuous Space for Postfix Expressions,https://openreview.net/forum?id=9dp35y5C0p,"Dongjie Wang, Meng Xiao, Min Wu, pengfei wang, Yuanchun Zhou, Yanjie Fu"
Variational Inference with Gaussian Score Matching,https://openreview.net/forum?id=5TTV5IZnLL,"Chirag Modi, Robert Gower, Charles Margossian, Yuling Yao, David Blei, Lawrence Saul"
Discriminative Calibration: Check Bayesian Computation from Simulations and Flexible Classifier,https://openreview.net/forum?id=2Cmdh5z6ph,"Yuling Yao, Justin Domke"
Modeling Human Visual Motion Processing with Trainable Motion Energy Sensing and a Self-attention Network,https://openreview.net/forum?id=tRKimbAk5D,"Zitang Sun, Yen-Ju Chen, Yung-Hao Yang, Shin'ya Nishida"
Hypervolume Maximization: A Geometric View of Pareto Set Learning,https://openreview.net/forum?id=9ieV1hnuva,"Xiaoyuan Zhang, Xi Lin, Bo Xue, Yifan Chen, Qingfu Zhang"
Generative Pre-Training of Spatio-Temporal Graph Neural Networks,https://openreview.net/forum?id=nMH5cUaSj8,"Zhonghang Li, Lianghao Xia, Yong Xu, Chao Huang"
StreamNet: Memory-Efficient Streaming Tiny Deep Learning Inference on the Microcontroller,https://openreview.net/forum?id=5t5u8PQa2T,"Hong-Sheng Zheng, Yu-Yuan Liu, Chen-Fong Hsu, Tsung Tai Yeh"
Fed-CO$_{2}$: Cooperation of Online and Offline Models for Severe Data Heterogeneity in Federated Learning,https://openreview.net/forum?id=dEDdRWunxU,"Zhongyi Cai, Ye Shi, Wei Huang, Jingya Wang"
S-CLIP: Semi-supervised Vision-Language Learning using Few Specialist Captions,https://openreview.net/forum?id=O1lYncfVOO,"Sangwoo Mo, Minkyu Kim, Kyungmin Lee, Jinwoo Shin"
No-regret Algorithms for Fair Resource Allocation,https://openreview.net/forum?id=crNAh1EZKo,"Abhishek Sinha, Ativ Joshi, Rajarshi Bhattacharjee, Cameron Musco, Mohammad Hajiesmaili"
Estimating Riemannian Metric with Noise-Contaminated Intrinsic Distance,https://openreview.net/forum?id=VhLU3pStsl,"Jiaming Qiu, Xiongtao Dai"
FlowPG: Action-constrained Policy Gradient with Normalizing Flows,https://openreview.net/forum?id=p1gzxzJ4Y5,"Janaka Brahmanage, Jiajing LING, Akshat Kumar"
Optimal Treatment Regimes for Proximal Causal Learning,https://openreview.net/forum?id=zGdH4tKtOW,"Tao Shen, Yifan Cui"
SafeDICE: Offline Safe Imitation Learning with Non-Preferred Demonstrations,https://openreview.net/forum?id=toEGuA9Qfn,"Youngsoo Jang, Geon-Hyeong Kim, Jongmin Lee, Sungryull Sohn, Byoungjip Kim, Honglak Lee, Moontae Lee"
ASPEN: Breaking Operator Barriers for Efficient Parallelization of Deep Neural Networks,https://openreview.net/forum?id=eTp4RetK74,"Jongseok Park, Kyungmin Bin, Gibum Park, Sangtae Ha, Kyunghan Lee"
Beyond Confidence: Reliable Models Should Also Consider Atypicality,https://openreview.net/forum?id=ZVRG3toCTT,"Mert Yuksekgonul, Linjun Zhang, James Zou, Carlos Guestrin"
"Fair, Polylog-Approximate Low-Cost Hierarchical Clustering",https://openreview.net/forum?id=cAPMmCl2f3,"Marina Knittel, Max Springer, John Dickerson, MohammadTaghi Hajiaghayi"
CP-SLAM: Collaborative Neural Point-based SLAM System,https://openreview.net/forum?id=dFSeZm6dTC,"Jiarui Hu, Mao Mao, Hujun Bao, Guofeng Zhang, Zhaopeng Cui"
RS-Del: Edit Distance Robustness Certificates for Sequence Classifiers via Randomized Deletion,https://openreview.net/forum?id=ffFcRPpnWx,"Zhuoqun Huang, Neil G Marchant, Keane Lucas, Lujo Bauer, Olga Ohrimenko, Benjamin Rubinstein"
Separable Physics-Informed Neural Networks,https://openreview.net/forum?id=dEySGIcDnI,"Junwoo Cho, Seungtae Nam, Hyunmo Yang, Seok-Bae Yun, Youngjoon Hong, Eunbyung Park"
For SALE: State-Action Representation Learning for Deep Reinforcement Learning,https://openreview.net/forum?id=xZvGrzRq17,"Scott Fujimoto, Wei-Di Chang, Edward Smith, Shixiang (Shane) Gu, Doina Precup, David Meger"
AD-PT: Autonomous Driving Pre-Training with Large-scale Point Cloud Dataset,https://openreview.net/forum?id=eIFZtkshgH,"Jiakang Yuan, Bo Zhang, Xiangchao Yan, Botian Shi, Tao Chen, Yikang LI, Yu Qiao"
LMC: Large Model Collaboration with Cross-assessment for Training-Free Open-Set Object Recognition,https://openreview.net/forum?id=dHF3Im8Aic,"Haoxuan Qu, Xiaofei Hui, Yujun Cai, Jun Liu"
Auditing Fairness by Betting,https://openreview.net/forum?id=EEVpt3dJQj,"Ben Chugg, Santiago Cortes-Gomez, Bryan Wilder, Aaditya Ramdas"
An Inductive Bias for Tabular Deep Learning,https://openreview.net/forum?id=XEUc1JegGt,"Ege Beyazit, Jonathan Kozaczuk, Bo Li, Vanessa Wallace, Bilal Fadlallah"
Cross-Domain Policy Adaptation via Value-Guided Data Filtering,https://openreview.net/forum?id=qdM260dXsa,"Kang Xu, Chenjia Bai, Xiaoteng Ma, Dong Wang, Bin Zhao, Zhen Wang, Xuelong Li, Wei Li"
Unified Enhancement of Privacy Bounds for Mixture Mechanisms via $f$-Differential Privacy,https://openreview.net/forum?id=pw5hEuEroL,"Chendi Wang, Buxin Su, Jiayuan Ye, Reza Shokri, Weijie Su"
Initialization Matters: Privacy-Utility Analysis of Overparameterized Neural Networks,https://openreview.net/forum?id=IKvxmnHjkL,"Jiayuan Ye, Zhenyu Zhu, Fanghui Liu, Reza Shokri, Volkan Cevher"
Learning Dense Flow Field for Highly-accurate Cross-view Camera Localization,https://openreview.net/forum?id=HPrd17Qvbp,"Zhenbo Song, ze xianghui, Jianfeng Lu, Yujiao Shi"
MoVie: Visual Model-Based Policy Adaptation for View Generalization,https://openreview.net/forum?id=YV1MYtj2AR,"Sizhe Yang, Yanjie Ze, Huazhe Xu"
H-InDex: Visual Reinforcement Learning with Hand-Informed Representations for Dexterous Manipulation,https://openreview.net/forum?id=lvvaNwnP6M,"Yanjie Ze, Yuyao Liu, Ruizhe Shi, Jiaxin Qin, Zhecheng Yuan, Jiashun Wang, Huazhe Xu"
"A General Theory of Correct, Incorrect, and Extrinsic Equivariance",https://openreview.net/forum?id=2FMJtNDLeE,"Dian Wang, Xupeng Zhu, Jung Yeon Park, Mingxi Jia, Guanang Su, Robert Platt, Robin Walters"
Modeling Dynamics over Meshes with Gauge Equivariant Nonlinear Message Passing,https://openreview.net/forum?id=0eXniewIvr,"Jung Yeon Park, Lawson Wong, Robin Walters"
Globally injective and bijective neural operators,https://openreview.net/forum?id=6cc69ArD3O,"Takashi Furuya, Michael Puthawala, Matti Lassas, Maarten V. de Hoop"
ComSL: A Composite Speech-Language Model for End-to-End Speech-to-Text Translation,https://openreview.net/forum?id=6Qx7G1xrAk,"Chenyang Le, Yao Qian, Long Zhou, Shujie LIU, Yanmin Qian, Michael Zeng, Xuedong Huang"
DFRD: Data-Free Robustness Distillation for Heterogeneous Federated Learning,https://openreview.net/forum?id=3H9QH1v6U9,"kangyang Luo, Shuai Wang, Yexuan Fu, Xiang Li, Yunshi Lan, Ming Gao"
An Information-Theoretic Evaluation of Generative Models in Learning Multi-modal Distributions,https://openreview.net/forum?id=PdZhf6PiAb,"Mohammad Jalali, Cheuk Ting Li, Farzan Farnia"
GAUCHE: A Library for Gaussian Processes in Chemistry,https://openreview.net/forum?id=vzrA6uqOis,"Ryan-Rhys Griffiths, Leo Klarner, Henry Moss, Aditya Ravuri, Sang Truong, Yuanqi Du, Samuel Stanton, Gary Tom, Bojana Rankovic, Arian Jamasb, Aryan Deshwal, Julius Schwartz, Austin Tripp, Gregory Kell, Simon Frieder, Anthony Bourached, Alex Chan, Jacob Moss, Chengzhi Guo, Johannes Peter Dürholt, Saudamini Chaurasia, Ji Won Park, Felix Strieth-Kalthoff, Alpha Lee, Bingqing Cheng, Alan Aspuru-Guzik, Philippe Schwaller, Jian Tang"
Structure-free Graph Condensation: From Large-scale Graphs to Condensed Graph-free Data,https://openreview.net/forum?id=XkcufOcgUc,"Xin Zheng, Miao Zhang, Chunyang Chen, Quoc Viet Hung Nguyen, Xingquan Zhu, Shirui Pan"
AdaVAE: Bayesian Structural Adaptation for Variational Autoencoders,https://openreview.net/forum?id=gMjIUZBKH8,"Paribesh Regmi, Rui Li"
Squared Neural Families: A New Class of Tractable Density Models,https://openreview.net/forum?id=FDzQQTPqEJ,"Russell Tsuchida, Cheng Soon Ong, Dino Sejdinovic"
"PIXIU: A Comprehensive Benchmark, Instruction Dataset and Large Language Model for Finance",https://openreview.net/forum?id=vTrRq6vCQH,"Qianqian Xie, Weiguang Han, Xiao Zhang, Yanzhao Lai, Min Peng, Alejandro Lopez-Lira, Jimin Huang"
Deciphering Spatio-Temporal Graph Forecasting: A Causal Lens and Treatment,https://openreview.net/forum?id=17Zkztjlgt,"Yutong Xia, Yuxuan Liang, Haomin Wen, Xu Liu, Kun Wang, Zhengyang Zhou, Roger Zimmermann"
Towards Semi-Structured Automatic ICD Coding via Tree-based Contrastive Learning,https://openreview.net/forum?id=Wff6DWFY2W,"Chang Lu, Chandan Reddy, Ping Wang, Yue Ning"
TabMT: Generating tabular data with masked transformers,https://openreview.net/forum?id=qs4swxtIAQ,"Manbir Gulati, Paul Roysdon"
Described Object Detection: Liberating Object Detection with Flexible Expressions,https://openreview.net/forum?id=0hwq2vOHT4,"Chi Xie, Zhao Zhang, Yixuan Wu, Feng Zhu, Rui Zhao, Shuang Liang"
Topological Parallax: A Geometric Specification for Deep Perception Models,https://openreview.net/forum?id=SthlUe5xDP,"Abraham Smith, Michael Catanzaro, Gabrielle Angeloro, Nirav Patel, Paul Bendich"
Sketching Algorithms for Sparse Dictionary Learning: PTAS and Turnstile Streaming,https://openreview.net/forum?id=qHzEFxtheD,"Gregory Dexter, Petros Drineas, David Woodruff, Taisuke Yasuda"
Unleashing the Power of Randomization in Auditing Differentially Private ML,https://openreview.net/forum?id=mlbes5TAAg,"Krishna Pillutla, Galen Andrew, Peter Kairouz, H. Brendan McMahan, Alina Oprea, Sewoong Oh"
Learning Modulated Transformation in GANs,https://openreview.net/forum?id=h8vJVABiBP,"Ceyuan Yang, Qihang Zhang, Yinghao Xu, Jiapeng Zhu, Yujun Shen, Bo Dai"
Decompose a Task into Generalizable Subtasks in Multi-Agent Reinforcement Learning,https://openreview.net/forum?id=aky0dKv9ip,"Zikang Tian, Ruizhi Chen, Xing Hu, Ling Li, Rui Zhang, Fan Wu, Shaohui Peng, Jiaming Guo, Zidong Du, Qi Guo, Yunji Chen"
Disentangled Wasserstein Autoencoder for T-Cell Receptor Engineering,https://openreview.net/forum?id=Eb74zfBkWa,"Tianxiao Li, Hongyu Guo, Filippo Grazioli, Mark Gerstein, Martin Renqiang Min"
Active representation learning for general task space with applications in robotics,https://openreview.net/forum?id=RiwPYAMLur,"Yifang Chen, Yingbing Huang, Simon Du, Kevin Jamieson, Guanya Shi"
Towards Federated Foundation Models: Scalable Dataset Pipelines for Group-Structured Learning,https://openreview.net/forum?id=EPz1DcdPVE,"Zachary Charles, Nicole Mitchell, Krishna Pillutla, Michael Reneer, Zachary Garrett"
On Occlusions in Video Action Detection: Benchmark Datasets And Training Recipes,https://openreview.net/forum?id=0cltUI2Sto,"Rajat Modi, Vibhav Vineet, Yogesh Rawat"
Hierarchical Open-vocabulary Universal Image Segmentation,https://openreview.net/forum?id=bn4qZxltsH,"Xudong Wang, Shufan Li, Konstantinos Kallidromitis, Yusuke Kato, Kazuki Kozuka, Trevor Darrell"
"Live Graph Lab: Towards Open, Dynamic and Real Transaction Graphs with NFT",https://openreview.net/forum?id=zr1e15kczE,"Zhen Zhang, Bingqiao Luo, Shengliang Lu, Bingsheng He"
NeuroEvoBench:  Benchmarking Evolutionary Optimizers for Deep Learning Applications,https://openreview.net/forum?id=s6qtLyR6uJ,"Robert Lange, Yujin Tang, Yingtao Tian"
Chanakya: Learning Runtime Decisions for Adaptive Real-Time Perception,https://openreview.net/forum?id=VpCjozUOM2,"Anurag Ghosh, Vaibhav Balloli, Akshay Nambi, Aditya Singh, Tanuja Ganu"
Diffusion Probabilistic Models for Structured Node Classification,https://openreview.net/forum?id=CxUuCydMDU,"Hyosoon Jang, Seonghyun Park, Sangwoo Mo, Sungsoo Ahn"
Layer-Neighbor Sampling --- Defusing Neighborhood Explosion in GNNs,https://openreview.net/forum?id=Kd5W4JRsfV,"Muhammed Fatih Balin, Ümit Çatalyürek"
Three Iterations of (d − 1)-WL Test Distinguish Non Isometric Clouds of d-dimensional Points,https://openreview.net/forum?id=9yhYcjsdab,"Valentino Delle Rose, Alexander Kozachinskiy, Cristobal Rojas, Mircea Petrache, Pablo Barceló"
Approximation-Generalization Trade-offs under (Approximate) Group Equivariance,https://openreview.net/forum?id=DnO6LTQ77U,"Mircea Petrache, Shubhendu Trivedi"
Global Identifiability of  $\ell_1$-based Dictionary Learning via Matrix Volume Optimization,https://openreview.net/forum?id=JK2oPrP8B3,"Jingzhou Hu, Kejun Huang"
GNNEvaluator: Evaluating GNN Performance On Unseen Graphs Without Labels,https://openreview.net/forum?id=ihlT8yvQ2I,"Xin Zheng, Miao Zhang, Chunyang Chen, Soheila Molaei, Chuan Zhou, Shirui Pan"
Reference-Based POMDPs,https://openreview.net/forum?id=4Sn2vUs0zA,"Edward Kim, Yohan Karunanayake, Hanna Kurniawati"
Efficient Policy Adaptation with Contrastive Prompt Ensemble for Embodied Agents,https://openreview.net/forum?id=Ny3GcHLyzj,"wonje choi, Woo Kyung Kim, SeungHyun Kim, Honguk Woo"
Pairwise Causality Guided Transformers for Event Sequences,https://openreview.net/forum?id=5q8xovQF7r,"Xiao Shou, Debarun Bhattacharjya, Tian Gao, Dharmashankar Subramanian, Oktie Hassanzadeh, Kristin P Bennett"
Evaluating the Moral Beliefs Encoded in LLMs,https://openreview.net/forum?id=O06z2G18me,"Nino Scherrer, Claudia Shi, Amir Feder, David Blei"
Learning to Taste: A Multimodal Wine Dataset,https://openreview.net/forum?id=VeJgZYhT7H,"Thoranna Bender, Simon Sørensen, Alireza Kashani, Kristjan Hjorleifsson, Grethe Hyldig, Søren Hauberg, Serge Belongie, Frederik Warburg"
Adversarial Learning for Feature Shift Detection and Correction,https://openreview.net/forum?id=lBhRTO2uWf,"Míriam Barrabés, Daniel Mas Montserrat, Margarita Geleta, Xavier Giró-i-Nieto, Alexander Ioannidis"
Can Language Models Solve Graph Problems in Natural Language?,https://openreview.net/forum?id=UDqHhbqYJV,"Heng Wang, Shangbin Feng, Tianxing He, Zhaoxuan Tan, Xiaochuang Han, Yulia Tsvetkov"
Decoding the Enigma: Benchmarking Humans and AIs on the Many Facets of Working Memory,https://openreview.net/forum?id=10R4Fg1aA0,"Ankur Sikarwar, Mengmi Zhang"
[Re] Exploring the Role of Grammar and Word Choice in Bias Toward African American English (AAE) in Hate Speech Classification,https://openreview.net/forum?id=MjZVx7a0KX-,"Priyanka Bose, Chandra shekhar Pandey, Fraida Fund"
Simultaneous embedding of multiple attractor manifolds in a recurrent neural network using constrained gradient optimization,https://openreview.net/forum?id=ekMLUoC2sq,"Haggai Agmon, Yoram Burak"
Calibration by Distribution Matching: Trainable Kernel Calibration Metrics,https://openreview.net/forum?id=IhxD94i5ra,"Charlie Marx, Sofian Zalouk, Stefano Ermon"
H2O: Heavy-Hitter Oracle for Efficient Generative Inference of Large Language Models,https://openreview.net/forum?id=RkRrPp7GKO,"Zhenyu Zhang, Ying Sheng, Tianyi Zhou, Tianlong Chen, Lianmin Zheng, Ruisi Cai, Zhao Song, Yuandong Tian, Christopher Ré, Clark Barrett, Zhangyang ""Atlas"" Wang, Beidi Chen"
"Neural Injective Functions for Multisets, Measures and Graphs via a Finite Witness Theorem",https://openreview.net/forum?id=TQlpqmCeMe,"Tal Amir, Steven Gortler, Ilai Avni, Ravina Ravina, Nadav Dym"
[Re] Variational Neural Cellular Automata,https://openreview.net/forum?id=d7-ns6SZqp,"Albert Sund Aillet, Simon Sondén"
"Three-Way Trade-Off in Multi-Objective Learning: Optimization, Generalization and Conflict-Avoidance",https://openreview.net/forum?id=yPkbdJxQ0o,"Lisha Chen, Heshan Fernando, Yiming Ying, Tianyi Chen"
Hierarchical Gaussian Mixture based Task Generative Model for Robust Meta-Learning,https://openreview.net/forum?id=mVTyeQIiE4,"Yizhou Zhang, Jingchao Ni, Wei Cheng, Zhengzhang Chen, Liang Tong, Haifeng Chen, Yan Liu"
Variational Imbalanced Regression: Fair Uncertainty Quantification via Probabilistic Smoothing,https://openreview.net/forum?id=cMUBkkTrMo,"Ziyan Wang, Hao Wang"
Should I Stop or Should I Go: Early Stopping with Heterogeneous Populations,https://openreview.net/forum?id=1CpVHL10fh,"Hammaad Adam, Fan Yin, Huibin Hu, Neil Tenenholtz, Lorin Crawford, Lester Mackey, Allison Koenecke"
Provable benefits of score matching,https://openreview.net/forum?id=waXoG35kbb,"Chirag Pabbaraju, Dhruv Rohatgi, Anish Prasad Sevekari, Holden Lee, Ankur Moitra, Andrej Risteski"
Connecting Pre-trained Language Model and Downstream Task via Properties of Representation,https://openreview.net/forum?id=YLOJ4aKAka,"Chenwei Wu, Holden Lee, Rong Ge"
OpenProteinSet: Training data for structural biology at scale,https://openreview.net/forum?id=gO0kS0eE0F,"Gustaf Ahdritz, Nazim Bouatta, Sachin Kadyan, Lukas Jarosch, Dan Berenberg, Ian Fisk, Andrew Watkins, Stephen Ra, Richard Bonneau, Mohammed AlQuraishi"
3D molecule generation by denoising voxel grids,https://openreview.net/forum?id=Zyzluw0hC4,"Pedro O. Pinheiro, Joshua Rackers, Joseph Kleinhenz, Michael Maser, Omar Mahmood, Andrew Watkins, Stephen Ra, Vishnu Sresht, Saeed Saremi"
VTaC: A  Benchmark Dataset of Ventricular Tachycardia Alarms from ICU Monitors,https://openreview.net/forum?id=qf4CWnrvZa,"Li-wei Lehman, Benjamin Moody, Harsh Deep, Feng Wu, Hasan Saeed, Lucas McCullum, Diane Perry, Tristan Struja, Qiao Li, Gari Clifford, Roger Mark"
A Unified Fast Gradient Clipping Framework for DP-SGD,https://openreview.net/forum?id=i2H2sEiq2T,"Weiwei Kong, Andres Munoz Medina"
Objaverse-XL: A Universe of 10M+ 3D Objects,https://openreview.net/forum?id=Sq3CLKJeiz,"Matt Deitke, Ruoshi Liu, Matthew Wallingford, Huong Ngo, Oscar Michel, Aditya Kusupati, Alan Fan, Christian Laforte, Vikram Voleti, Samir Yitzhak Gadre, Eli VanderBilt, Aniruddha Kembhavi, Carl Vondrick, Georgia Gkioxari, Kiana Ehsani, Ludwig Schmidt, Ali Farhadi"
OBJECT 3DIT: Language-guided 3D-aware Image Editing,https://openreview.net/forum?id=yjWVd8Fhqt,"Oscar Michel, Anand Bhattad, Eli VanderBilt, Ranjay Krishna, Aniruddha Kembhavi, Tanmay Gupta"
Towards Automated Circuit Discovery for Mechanistic Interpretability,https://openreview.net/forum?id=89ia77nZ8u,"Arthur Conmy, Augustine Mavor-Parker, Aengus Lynch, Stefan Heimersheim, Adrià Garriga-Alonso"
The Distortion of Binomial Voting Defies Expectation,https://openreview.net/forum?id=Sv5bo2StIx,"Yannai A. Gonczarowski, Gregory Kehne, Ariel Procaccia, Ben Schiffer, Shirley Zhang"
Representational Strengths and Limitations of Transformers,https://openreview.net/forum?id=36DxONZ9bA,"Clayton Sanford, Daniel Hsu, Matus Telgarsky"
ARTIC3D: Learning Robust Articulated 3D Shapes from Noisy Web Image Collections,https://openreview.net/forum?id=rJc5Lsn5QU,"Chun-Han Yao, Amit Raj, Wei-Chih Hung, Michael Rubinstein, Yuanzhen Li, Ming-Hsuan Yang, Varun Jampani"
Video Timeline Modeling For News Story Understanding,https://openreview.net/forum?id=EBYZSRRzSE,"Meng Liu, Mingda Zhang, Jialu Liu, Hanjun Dai, Ming-Hsuan Yang, Shuiwang Ji, Zheyun Feng, Boqing Gong"
Data-Informed Geometric Space Selection,https://openreview.net/forum?id=fpElyckKkd,"Shuai Zhang, Wenqi Jiang"
A Tale of Two Features: Stable Diffusion Complements DINO for Zero-Shot Semantic Correspondence,https://openreview.net/forum?id=lds9D17HRd,"Junyi Zhang, Charles Herrmann, Junhwa Hur, Luisa Polania Cabrera, Varun Jampani, Deqing Sun, Ming-Hsuan Yang"
LayoutGPT: Compositional Visual Planning and Generation with Large Language Models,https://openreview.net/forum?id=Xu8aG5Q8M3,"Weixi Feng, Wanrong Zhu, Tsu-Jui Fu, Varun Jampani, Arjun Akula, Xuehai He, S Basu, Xin Eric Wang, William Yang Wang"
NAVI: Category-Agnostic Image Collections with High-Quality 3D Shape and Pose Annotations,https://openreview.net/forum?id=8TMhs2pIfG,"Varun Jampani, Kevis-kokitsi Maninis, Andreas Engelhardt, Arjun Karpur, Karen Truong, Kyle Sargent, Stefan Popov, Andre Araujo, Ricardo Martin Brualla, Kaushal Patel, Daniel Vlasic, Vittorio Ferrari, Ameesh Makadia, Ce Liu, Yuanzhen Li, Howard Zhou"
Neural Combinatorial Optimization with Heavy Decoder: Toward Large Scale Generalization,https://openreview.net/forum?id=RBI4oAbdpm,"Fu Luo, Xi Lin, Fei Liu, Qingfu Zhang, Zhenkun Wang"
Sample Complexity of Forecast Aggregation,https://openreview.net/forum?id=dlDFakG6kJ,"Tao Lin, Yiling Chen"
Double and Single Descent in Causal Inference with an Application to High-Dimensional Synthetic Control,https://openreview.net/forum?id=dL0GM9Wwtq,"Jann Spiess, guido imbens, Amar Venugopal"
"AMAG: Additive, Multiplicative and Adaptive Graph Neural Network For Forecasting Neuron Activity",https://openreview.net/forum?id=7ntI4kcoqG,"Jingyuan Li, Leo Scholl, Trung Le, Pavithra Rajeswaran, Amy Orsborn, Eli Shlizerman"
Generalized test utilities for long-tail performance in extreme multi-label classification,https://openreview.net/forum?id=jze2r6RDFz,"Erik Schultheis, Marek Wydmuch, Wojciech Kotlowski, Rohit Babbar, Krzysztof Dembczynski"
